"Location";"Status";"Authors";"Title";"Bibliographical reference";"Composition (year_from)";"Composition (year_to)";"First publication (year_from)";"First publication (year_to)";"Language";"Text";"Comment";"General reference";"Line reference";"Overlap/Similarity";"Modifications";"Marking for work";"Marking for author";"Genre";"Subject";"Narrative voice";"Textual functions";"Intertextual relations";"Source";"Bib. ref. source";"URL";"Internal comment";"Contributor"
" say an old man is twice a child.";"provisional";"Thomas zzzMiddleton / Cyril zzzTourneur";"The Revenger's Tragedy";"Middleton, Thomas and Cyril Tourneur.  ""The Revenger's Tragedy."" English Renaissance Drama: A Norton Anthology. Gen. ed. David Bevington. New York and London: W. W. Norton, 2002. 1303-1369.  act 1, scene 1.";"1606";"1606";"1606";"1606";"English";"[Duchess:] Was't ever known stepduchess was so mild<br>
And calm as I? Some now would plot his death, <br>
With easy doctors, those loose-living men, <br>
And make His withered Grace fall to his grave<br>
And keep church better.<br>
Some second wife would do this, and dispatch <br>
Her double loathèd lord at meat and sleep.<br>
<span class=""quote"">Indeed, 'tis true an old man's twice a childe,</span> <br>
Mine cannot speak; one of his single words, <br>
Would quite have freed my youngest dearest son<br>
From death or durance, and have made him walk<br>
With a bold foote vpon the thorny law,<br>
Whose prickles should bow under him, but 'tis not, <br>
And therefore wedlock faith shall be forgot, <br>
I'll kill him in his forehead, hate there feed, <br>
That wound is deepest though it neuer bleed.";"";"";"@001520 The Revengers Tragedy";"idea (proverbial)";"#000414 old man twice a child";"Unmarked";"Unmarked";"Theatre";"tbe";"Dialogue";"Body of text";"Local reference";"Electronic search (HyperHamlet Team)";"@010001";"[Dutchesse:] Wast euer knowne step-Dutchesse was so milde, <br>
And calme as I? some now would plot his death, <br>
With easie Doctors, those loose liuing men, <br>
And make his witherd Grace fall to his Graue, <br>
And keepe Church better? <br>
Some second wife would do this, and dispatch <br>
Her double loathd Lord at meate and sleepe, <br>
<span class=""quote"">Indeed 'tis true an old mans twice a childe,</span> <br>
Mine cannot speake, one of his single words, <br>
Would quite haue freed my yongest deerest sonne <br>
From death or durance, and haue made him walke <br>
With a bold foote vpon the thornie law, <br>
Whose Prickles should bow vnder him, but 'tis not, <br>
And therefore wedlock faith shall be forgot, <br>
Ile kill him in his fore-head, hate there feede, <br>
That wound is deepest tho it neuer bleed [...].";"Middleton, Thomas and Cyril Tourneur.  The Revengers Tragaedie. As it hath beene sundry times Acted, by the Kings Maiesties Seruants. London: G. Eld, 1607.  N.p.; act 1, scene 1.";"Gebhard Christian"
" Full thirty times hath Phoebus' cart gone round";"ok";"Francis zzzBeaumont / John zzzFletcher";"The Woman-Hater";"Beaumont, Francis and John Fletcher.  ""The Woman-Hater."" The Dramatic Works in the Beaumont and Fletcher Canon. Ed. F. Bowers. 10 vols. Cambridge: Cambridge University Press, 1966. Vol. 1, 145-259.  179; act 2, scene 1 [normalized spelling].";"1606";"1606";"1607";"1607";"English";"[Duke of Millain]: How old are you? <br>
[Lazarello]: <span class=""quote"">Full eight and twenty </span>several Almanacks<br> 
Hath been compiled, all for several years <br>
Since first I drew this breath; four apprenticeships <br>
Have I most truly served in this world: <br>
<span class=""quote"">And eight and twenty times hath <i>Phoebus </i>Cart<br> 
Run out his yearly course since - <br></span>
[Duke]: I understand you Sir. <br>
[Lucio]: How like an ignorant Poet he talks.";"First performance 1606.";"";"@001522 The Woman-Hater";"image with keyword(s)";"#002103 Phoebus cart ";"Unmarked";"Unmarked";"Theatre";"";"Dialogue";"Body of text";"Local reference";"Shakespeare Studies";"@010005
Greenfield, Sayre. ""Quoting Hamlet in the Early Seventeenth Century."" Modern Philology 105.3 (2008): 510-534. ";"[Duke of Millain]: How old are you? <br>
[Lazarello]: <span class=""quote"">Full eight and twenty </span>severall Almanackes<br> 
Hath been compiyed, all for severall yeares <br>
Since first I drew this breath; foure prentiships <br>
Have I most truly served in this world: <br>
<span class=""quote"">And eight and twenty times hath <i>Phoebus </i>Carre<br> 
Runne out his yearely course since - <br></span>
[Duke]: I understand you Sir. <br>
[Lucio]: How like an ignorant Poet he talkes.";"Beaumont, Francis and John Fletcher.  ""The Woman-Hater."" The Dramatic Works in the Beaumont and Fletcher Canon. Ed. F. Bowers. 10 vols. Cambridge: Cambridge University Press, 1966. Vol. 1, 145-259.  179; act 2, scene 1.";"  Hohl Trillini Regula"
" Ay, sir; to be honest, as this world goes, is to be";"ok";"Francis zzzBeaumont / John zzzFletcher";"The Woman-Hater";"Beaumont, Francis and John Fletcher.  ""The Woman-Hater."" The Dramatic Works in the Beaumont and Fletcher Canon. Ed. F. Bowers. 10 vols. Cambridge: Cambridge University Press, 1966. Vol. 1, 145-259.  179 [normalized spelling].";"1606";"1606";"1607";"1607";"English";"[Count]: I am glad to meet you here Sister.<br>
[Oriana]: I thank you good Brother: and if you doubt of the cause of my coming I can Satisfy you.<br>
[Count]:<span class=""quote""> No faith, I dare trust thee, I do suspect thou art honest; for it is so rare a thing to be honest amongst you, that some one man in an age, may perhaps suspect some two women to be honest, but never believe it verily.</span>";"";"";"@001522 The Woman-Hater";"idea";"#002087 honesty is rare";"Unmarked";"Unmarked";"Theatre";"";"Dialogue";"Body of text";"Local reference";"Shakespeare Studies";"@010005
Greenfield, Sayre. ""Quoting Hamlet in the Early Seventeenth Century."" Modern Philology 105.3 (2008): 510-534. ";"[Count]: I am glad to meet you here Sister.<br>
[Oriana]: I thank you good Brother: and if you doubt of the cause of my comming I can Satisfie you.<br>
[Count]:<span class=""quote""> No faith, I dare trust thee, I doe suspect thou art honest; for it is so rare a thing to bee honest amongst you, that some one man in an age, may perhaps suspect some two women to be honest, but never beleeve it verily.</span>";"Beaumont, Francis and John Fletcher.  ""The Woman-Hater."" The Dramatic Works in the Beaumont and Fletcher Canon. Ed. F. Bowers. 10 vols. Cambridge: Cambridge University Press, 1966. Vol. 1, 145-259.  179.";"  Hohl Trillini Regula"
" And both neglect. What if this cursed hand";"provisional";"William zzzShakespeare";"Macbeth";"Shakespeare, William.  Macbeth.  Act 5, scene 1, lines 53-55.";"1606";"1606";"1606";"1606";"English";"[Lady Macbeth:] <span class=""quote"">Here's the smell of the blood still. All the perfumes of Arabia will not sweeten this little hand. </span>O, O, O!";"";"King's Men / Globe";"@001496 Macbeth";"image with keyword(s)";"#000064 IMAGE - sea cannot  wash bloody hands";"Unmarked";"Unmarked";"Tragedy";"";"Dialogue";"Body of text";"Local reference";"Electronic search (WordWeb Team)";"@010084 ";"";"";"  Hohl Trillini Regula"
" But, look, the morn, in russet mantle clad,";"ok";"Thomas Tomkis";"Lingua";"Tomkis, Thomas.  Lingva: Or The Combat of the Tongue, and the fiue Senses For Superiority. A Pleasant Comoedie. London: G. Eld for Simon Waterson, 1607.  B2verso; act 1, scene 5. ";"1606";"1606";"1606";"1606";"English";"(Tactus, in a darke coloured Sattin mantle over a paire of silke Baset, a Garland of Bayes mixt with red and white Roses [...] etc.)<br>
[Mendacio:] Now chast <i>Diana </i>grant my netts to hold.<br>
[Tactus:] The blasting Child-hood of the cheerfull <span class=""quote"">morne</span> <br>
Is almost growne a youth and <span class=""quote"">ouer-climbes <br>
Yonder gilt Easterne hills</span> [...].";"""The play is ascribed to A. Brewer in the British Museum Catalogue, but is now thought to be the work of Thomas Tomkis. [...] The [...] quotation from <i>Lingua</i> seems to refer to <i>Hamlet</i>, I, i, 167-8 [...]. Both of these passages are dubious allusions, but the play contains other strange similarities to Shakspere."" Cf. Ingleby, Clement Mansfield, et al., eds. The Shakspere AllusionBook: A Collection of Allusions to Shakspere from 1591 to 1700. Originally compiled by C. M. Ingleby, L. Toulmin Smith and F. J. Furnivall, with the Assistance of the New Shakspere Society: re-edited, re-vised, and re-arranged, with an Introduction, by John Munro (1909), and now re-issued with a Preface by Sir Edmund Chambers. 2 vols. Freeport (New York): Books for Libraries Press, 1970. Vol. 1, 113.";"";"@001524 Lingua";"pending";"#000257 morn over hill";"Unmarked";"Unmarked";"Comedy";"";"Dialogue";"Body of text";"Local reference";"Shakespeare Studies";"@010000-1:113.
Munro, John, Clement Mansfield Ingleby et al., eds. The Shakspere Allusion Book: A Collection of Allusions to Shakspere from 1591 to 1700 [...]. London: Chatto and Windus; New York: Duffield and Co., 1909.";"";"";"Rottmann Olivia"
" I should be greeted, if not from Lord Hamlet.";"provisional";"William zzzShakespeare";"Macbeth";"Shakespeare, William.  Macbeth.  Act 1, scene 4, lines 50-52.";"1606";"1606";"1606";"1606";"English";"[Macbeth:] <span class=""quote"">The rest is labor </span>which is not used for you. <br>
I'll be myself the harbinger and make joyful<br>
The hearing of my wife with your approach.";"";"";"@001496 Macbeth";"sentence or verse line";"#000151 the rest is x";"Unmarked";"Unmarked";"Tragedy";"";"Dialogue";"Body of text";"Local reference";"Annotated Shakespeare edition";"@010082
Shakespeare, William. Hamlet. The Oxford Shakespeare. Ed. G. R. Hibbard. Oxford and New York: Oxford University Press, 1994.";"";"";"Quassdorf Sixta"
" And both neglect. What if this cursed hand";"ok";"William zzzShakespeare";"Macbeth";"Shakespeare, William.  Macbeth.  Act 2, scene 2, lines 78-81.";"1606";"1606";"1606";"1606";"English";"[Macbeth:] [...] <span class=""quote"">Will all great Neptune's ocean wash this blood<br>
Clean from my hand? No, this my hand will rather<br>
The multitudinous seas incarnadine,<br>
Making the green one red.</span>";"";"King's Men / Globe";"@001496 Macbeth";"pending";"#000064 IMAGE - sea cannot  wash bloody hands";"Unmarked";"Unmarked";"Tragedy";"";"Dialogue";"Body of text";"Local reference";"Annotated Shakespeare edition";"@010082/@010002-99./@005134-316
Shakespeare, William. Hamlet. The Oxford Shakespeare. Ed. G. R. Hibbard. Oxford and New York: Oxford University Press, 1994. ";"";"";"  Hohl Trillini Regula"
" I should be greeted, if not from Lord Hamlet.";"ok";"Francis zzzBeaumont / John zzzFletcher";"The Woman-Hater";"Beaumont, Francis and John Fletcher.  ""The Woman-Hater."" The Dramatic Works in the Beaumont and Fletcher Canon. Ed. F. Bowers. 10 vols. Cambridge: Cambridge University Press, 1966. Vol. 1, 145-259.  159 [normalized spelling].";"1606";"1606";"1606";"1606";"English";"[Duke:] Weightier far:<br>
You are my friends and you shall have the cause: <br>
I<span class=""quote""> break my sleeps </span> thus soon to see a wench.";"";"";"@001522 The Woman-Hater";"pending";"#000651 break your sleep";"Unmarked";"Unmarked";"Theatre";"";"Dialogue";"Body of text";"Local reference";"Electronic search (HyperHamlet Team)";"@010054
ECCO";"[Duke:] Waightier farre:<br>
You are my friendes and you shall have the cause: <br>
I<span class=""quote""> break my sleepes </span> thus soone to see a wench.";"Beaumont, Francis and John Fletcher.  ""The Woman-Hater."" The Dramatic Works in the Beaumont and Fletcher Canon. Ed. F. Bowers. 10 vols. Cambridge: Cambridge University Press, 1966. Vol. 1, 145-259.  159.";"Grandi de Souza Gustavo"
" I should be greeted, if not from Lord Hamlet.";"unedited";"Thomas zzzMiddleton";"Your Five Gallants";"Middleton, Thomas.  Your fiue Gallants. As it hath beene often in Action at the Black-friers. Written by T. Middleton. London: Richard Bonian, 1608.  N.p.; act 1. [spelling normalized].";"1607";"1607";"1607";"1607";"English";"[Frip:] [...] <span class=""quote"">here's none but friends </span>[...].";"Nathan Field, who uses this expression in his <i>Amends for Ladies</i> (1610), probably acted in this play.";"";"@001528 Your Five Gallants";"";"#05148 here is none but friends";"Unmarked";"Unmarked";"Comedy";"tbe";"Dialogue";"Body of text";"Local reference";"Annotated edition";"@010049-273.
Peery, William. The Plays of Nathan Field: Edited from the Original Quartos with Introduction and Notes. Austin: The University of Texas Press, 1950.  273.";"[Frip:] [...] <span class=""quote"">hers none but friends</span> [...].";"Middleton, Thomas.  Your fiue Gallants. As it hath beene often in Action at the Black-friers. Written by T. Middleton. London: Richard Bonian, 1608.  N.p.; act 1.";"Reitzer Elliot"
" O, that this too too solid flesh would melt";"ok";"Lording or Lodovic zzzBarry";"The Family of Love";"Barry, Lording.  The Familie of loue Acted by the children of his Maiesties Reuells. London: Richard Braddock for John Helmes, 1608.  A3 verso [normalized spelling].";"1607";"1607";"1607";"1607";"HAS SEVERAL LEXIAS!";"[Maria:] <span class=""quote"">O that this flesh could</span> like swift-moving thoughts <span class=""quote"">transfer itself, <br>
From place to place, unseen and undissolved.</span> 	";"Authorship and date of composition uncertain. Charles Cathcart argues for Marston (cf. Charles Cathcart. Marston, Rivalry, Rapprochement and Jonson. Aldershot: Ashgate, 2008).";"Children of the King&#039;s Revels  / Whitefriars, London";"@001529 The Family of Love";"idea with keyword(s)";"#000160 melted flesh, living clay / #000067 move unobstructed or swift as thought";"Unmarked";"Unmarked";"Comedy";"";"Dialogue";"Body of text";"Local reference";"Literary and Cultural Studies";"@010098
Cathcart, Charles. Marston, Rivalry, Rapprochement and Jonson. Aldershot: Ashgate, 2008.";"[Maria:] <span class=""quote"">O that this flesh could</span> like swift mouing thoughts <span class=""quote"">transfer it selfe, <br>
From place to place, vnseen and vndisolued.</span> 	";"Barry, Lording and John Marston.  The Familie of loue Acted by the children of his Maiesties Reuells. London: Richard Braddock for John Helmes, 1608. A3 verso.";"  Hohl Trillini Regula"
" O, God! a beast, that wants discourse of reason,";"ok";"Lording or Lodovic zzzBarry";"The Family of Love";"Barry, Lording.  The Familie of loue Acted by the children of his Maiesties Reuells. London: Richard Braddock for John Helmes, 1608.  H3 recto.	";"1607";"1607";"1607";"1607";"English";"[Glister:] What else, sir? I have <span class=""quote"">reason.<br></span>
[Dryfat:] I know it well, <span class=""quote"">I take you for no beast.</span>";"";"";"@001529 The Family of Love";"pending";"#000068 reason and beast";"Unmarked";"Unmarked";"Comedy";"";"Dialogue";"Body of text";"Local reference";"Shakespeare Studies";"@010153";"";"";"  Hohl Trillini Regula"
" they are the abstract and brief chronicles of the";"ok";"Lording or Lodovic zzzBarry";"The Family of Love";"Barry, Lording.  The Familie of loue Acted by the children of his Maiesties Reuells. London: Richard Braddock for John Helmes, 1608.  A3 verso.";"1607";"1607";"1607";"1607";"English";"[Gerardine:] This is <span class=""quote"">the abstract of the spacious world.	</span>";"";"";"@001529 The Family of Love";"";"#000025 abstract, brief chronicles";"Unmarked";"Unmarked";"Comedy";"";"Dialogue";"Body of text";"Local reference";"Annotated Shakespeare edition";"@010082
Shakespeare, William. Hamlet. The Oxford Shakespeare. Ed. G. R. Hibbard. Oxford and New York: Oxford University Press, 1994.";"";"";"  Hohl Trillini Regula"
" I should be greeted, if not from Lord Hamlet.";"unedited";"William zzzShakespeare";"Coriolanus";"Shakespeare, William.  Coriolanus.  Act 4, scene 6, lines 246-249.";"1608";"1608";"1608";"1608";"English";"[First Servingman:] […] <span class=""quote"">Peace is […] a getter of more bastard children than war is a destroyer of men.</span>";"";"";"@001589 Coriolanus";"";"#002153 bastard peace";"Unmarked";"Unmarked";"Theatre";"";"Dialogue";"Body of text";"Local reference";"Shakespeare Studies";"@010083-61.
Adams, Joseph Quincy, Jr.  ""William Heminge and Shakespeare."" Modern Philology 12:1 (May, 1914): 51-64.  61.";"";"";" Heeg Stefanie"
" I should be greeted, if not from Lord Hamlet.";"unedited";"William zzzShakespeare";"Coriolanus";"Shakespeare, William.  Coriolanus.  Act 1, scene 9, lines 48-49.";"1608";"1608";"1608";"1608";"English";"[Martius:] <span class=""quote"">When drums and trumpets shall
I' th' field prove flatterers</span> […].";"";"";"@001589 Coriolanus";"";"#002154 Drums and trumpets are flatterers";"Unmarked";"Unmarked";"Theatre";"";"Dialogue";"Body of text";"Local reference";"Shakespeare Studies";"@0100083-61.
Adams, Joseph Quincy, Jr.  ""William Heminge and Shakespeare."" Modern Philology 12:1 (May, 1914): 51-64.  61.";"";"";" Heeg Stefanie"
" By indirections find directions out:";"provisional";"Thomas Pickering";"The Whole Treatise of the Cases Of Conscience";"Pickering, Thomas,  ed. William Perkins. The Whole Treatise of the Cases Of Conscience, Distinguished into Three Books. Taught and delivered by M. W. Perkins in his holiday Lectures, examined by his owne briefs, and published for the common good, by Thomas Pickering. London: John Legatt, 1617.  N.p.; section ""To the Right Honorable, Edward, Lord Dennie Baron of Waltham, &c.""";"1608";"1608";"1608";"1608";"English";"By these instances, and many more that might be alleged to this purpose, it is apparant, upon how weake and unstable grounds the <i>Case-divinity</i> of the Popish Church standeth, and how <span class=""quote"">indirect a course they take</span>, for the resolution and <span class=""quote"">direction of the troubled Conscience</span>.";"";"";"@005132 The Whole Treatise of the Cases Of Conscience";"2 keywords";"#000211 indirections";"Unmarked";"Unmarked";"Bible or religious pamphlet";"Philosophy, religion  / tbe / genre preface although book as a whole has a different one";"";"Body of text";"Local reference";"Electronic search (HyperHamlet Team)";"@010107-Last accessed 19 June 2009.";"";"";"Quassdorf Sixta"
" I should be greeted, if not from Lord Hamlet.";"unedited";"Lording or Lodovic zzzBarry";"Ram Alley";"Barry, Lording.  Ram-Alley: Or Merrie-Trickes. A comedy Diuers times here-to-fore acted. By the Children of the Kings Reuels. Written by Lo: Barrey. London: G. Eld for Robert Wilson, 1611.  N.p.; act 1, lines 73-82. [spelling normalized].";"1608";"1608";"1608";"1608";"English";"[Frances:] You know sir,  <br>
I did enjoy a quiet country life, <br>
Spotless and free, till you corrupted me, <br> 
And brought me to the Court, I never knew, <br>
What sleeking, glazing, or what pressing meant, <br>
Till you preferred me to your Aunt the Lady, <br>
<span class=""quote"">I knew no Ivory teeth, no caps of hair, <br>
No <i>Mercury</i> water,</span> <i>fucas</i>, or perfumes, <br>
To helpe a Lady's breath, untill your Aunt, <br> 
Learnt me the common trick. ";"";"Children of the King&#039;s Revels  / Whitefriars, London";"@001572 Ram Alley";"3-word phrase";"#005114 mercury lotion pun";"Unmarked";"Unmarked";"Comedy";"tbe";"Dialogue";"Body of text";"Local reference";"Annotated edition";"@0100081-79.
Adams, Joseph Quincy, Jr. John Mason's The Turke edited from the Quartos of 1610 and 1632. Louvain: A. Uytpruyst, 1913. 79.";"[Frances:] You know sir,  <br>
I did inioy a quiet country life, <br>
Spotlesse and free, till you corrupted mee, <br> 
And brought me to the Court, I neuer knew, <br>
What sleeking, glazing, or what pressing meant, <br>
Till you preferd me to your Aunt the Lady, <br>
<span class=""quote"">I knew no Iuorie teeth, no caps of heire, <br>
No Mercury water,</span> fucas, or perfumes, <br>
To helpe a Ladies breath, vntill your Aunt, <br> 
Learnt me the common trick. ";"Barry, Lording.  Ram-Alley: Or Merrie-Trickes. A Comedy Divers times here-to-fore acted. By the Children of the Kings Reuels. Written by Lo: Barrey. London: G. Eld for Robert Wilson, 1611.  N.p.; act 1, lines 73-82.";"Reitzer Elliot"
" For this relief much thanks: 'tis bitter cold,";"provisional";"Francis zzzBeaumont / John zzzFletcher";"The Coxcomb";"Beaumont, Francis and John Fletcher.  ""The coxcombe."" Comedies and Tragedies Written by Francis Beaumont and Iohn Fletcher [...]. Never printed before, And now published by the Authours Originall Copies. London: Humphrey Robinson and Humphrey Moseley, 1647.  N.p. [normalized spelling]. ";"1609";"1609";"1609";"1609";"English";"[A Tinker (with a cord):] <span class=""quote"">'Tis bitter cold; </span>a plague upon these Rogues, how wary they are grown? not a door open now, but double bard, not a window, but up with a case of wood like a spice box, and their locks unpickable, the very smiths that were half venturers, drink penitent single Ale, this is the Iron age, the Ballad sings of; well I shall meet with some of our loose Linen yet, good fellows must not starve; here's he shall show you God a mighty's dog bolts, if this hold. ";"First performance between 1608 and 1610.";"Children of the Whitefriars / Unknown, London";"@001598 The Coxcomb";"sentence or verse line";"#000172 tis bitter cold";"Unmarked";"Unmarked";"Comedy";"tbe";"Dialogue";"Body of text";"Local reference";"Electronic search (HyperHamlet Team)";"@010001-Last accessed 27 December 2018.";"[A Tinker (with a cord):] <span class=""quote"">'Tis bitter cold; </span>a plague upon these Rogues, how wary they are growne? not a doore open now, but double bard, not a window, but up with a case of wood like a spice box, and their locks unpickable, the very smithes that were halfe venturers, drink penitent single Ale, this is the Iron age, the Ballad sings of; well I shall meet with some of our loose Linnen yet, good fellowes must not starve; heer's he shall shew you God a mighties dog bolts, if this hold. ";"Beaumont, Francis and John Fletcher.  ""The coxcombe."" Comedies and Tragedies Written by Francis Beaumont and Iohn Fletcher [...]. Never printed before, And now published by the Authours Originall Copies. London: Humphrey Robinson and Humphrey Moseley, 1647.  N.p. ";"Tranter Maria"
" I should be greeted, if not from Lord Hamlet.";"unedited";"Francis zzzBeaumont / John zzzFletcher";"The Coxcomb";"Beaumont, Francis and John Fletcher.  ""The coxcombe."" Comedies and Tragedies Written by Francis Beaumont and Iohn Fletcher [...]. Never printed before, And now published by the Authours Originall Copies. London: Humphrey Robinson and Humphrey Moseley, 1647.  115; act 5.";"1609";"1609";"1609";"1609";"English";"[Justice:] <span class=""quote"">There hangs a tale.</span>";"";"Children of the Whitefriars / Whitefriars, London";"@001598 The Coxcomb";"";"#005082 thereby hangs a tale";"Unmarked";"Unmarked";"Comedy";"";"Dialogue";"Body of text";"Local reference";"Electronic search (WordWeb Team)";"@010001";"";"";"Reitzer Elliot"
" I should be greeted, if not from Lord Hamlet.";"unedited";"Nathan zzzField";"Amends For Ladies";"Field, Nathan.  ""Amends for Ladies."" The Plays of Nathan Field: Edited from the Original Quartos with Introduction and Notes. Ed. William Peery. Austin: The University of Texas Press, 1950. 159-236.  172; act 1, scene 1, lines 373-374 [normalized spelling].";"1610";"1610";"1610";"1610";"English";"[Widow:] Nay prithee tell the cause, come <span class=""quote"">here's none but friends.</span>";"";"";"@001615 Amends for Ladies";"";"#05148 here is none but friends";"Unmarked";"Unmarked";"Theatre";"";"Dialogue";"Body of text";"Local reference";"Annotated edition";"@010049-273.
Peery, William, ed.  The Plays of Nathan Field: Edited from the Original Quartos with Introduction and Notes. Austin: The University of Texas Press, 1950.  273.";"[Widow:] Nay prithie tell the cause, come heer's none but friends.";"Field, Nathan.  ""Amends for Ladies."" The Plays of Nathan Field: Edited from the Original Quartos with Introduction and Notes. Ed. William Peery. Austin: The University of Texas Press, 1950. 159-236.  172; act 1, scene 1, lines 373-374.";"  Hohl Trillini Regula"
" I should be greeted, if not from Lord Hamlet.";"unedited";"Nathan zzzField";"Amends for Ladies";"Field, Nathan.  ""Amends for Ladies."" The Plays of Nathan Field: Edited from the Original Quartos with Introduction and Notes. Ed. William Peery. Austin: The University of Texas Press, 1950. 159-236.  191-192; act 3, scene 1, lines 2-6 [normalized spelling].";"1610";"1610";"1610";"1610";"English";"[Subtle:] She's a rare wife believe it, Sir, were all such,<br>
We never should have false inheritors.<br>
[Husband:] Pish friend, <span class=""quote"">there is not woman in the world<br>
Can hold out in the end, </span>if youth, shape, wit,<br>
Met in one subject, do assault her aptly [...].";"";"";"@001615 Amends for Ladies";"";"#005148 No woman can hold out in the end";"Unmarked";"Unmarked";"Tragedy";"";"Dialogue";"Body of text";"Local reference";"Annotated edition";"@010049-279.";"[Subtle:] Shee's a rare wife beleeue it, Sir, were all such,<br>
We neuer should have false inheritors.<br>
[Husband:] Pish friend, there is not woman in the world<br>
Can hold out in the end, if youth, shape, wit,<br>
Met in one subject, doe assault her aptlie [...].";"Field, Nathan.  ""Amends for Ladies."" The Plays of Nathan Field: Edited from the Original Quartos with Introduction and Notes. Ed. William Peery. Austin: The University of Texas Press, 1950. 159-236.  191-192; act 3, scene 1, lines 2-6.";"  Hohl Trillini Regula"
