"Location";"Status";"Authors";"Title";"Bibliographical reference";"Composition (year_from)";"Composition (year_to)";"First publication (year_from)";"First publication (year_to)";"Language";"Text";"Comment";"General reference";"Line reference";"Overlap/Similarity";"Modifications";"Marking for work";"Marking for author";"Genre";"Subject";"Narrative voice";"Textual functions";"Intertextual relations";"Source";"Bib. ref. source";"URL";"Internal comment";"Contributor"
" Revenge his foul and most unnatural murder.";"provisional";"_ 0_Anon";"A Warning for Fair Women";"Anon.  A Warning for Faire Women. As it hath beene lately diuerse times acted by the right Honorable, the Lord Chamberlaine his Seruantes. London: Valentine Sims for William Aspley, 1599.  N.p.; main text, lines 44-58 [normalised spelling].";"1597";"1597";"1597";"1597";"HAS SEVERAL LEXIAS!";"[Comedy:] How some damned tyrant to obtain a crown, <br>
Stabs, hangs, poisons, smothers, cuts throats, <br>
And then a Chorus too comes howling in, <br>
And tells us of the worrying of a cat, <br>
Then of <span class=""quote"">a filthy whining ghost, <br>
Lapt in some foul sheet, or a leather pelt, <br>
Comes screaming like a pig half sticked, <br>
And <span class=""quote"">cries Vindicta, revenge, revenge: </span><br></span>
With that a little rose flashes forth, <br>
Like smoke out of a Tobacco pipe, or a boys squib: <br>
Then comes in two or three like to drovers, <br>
With tailors bodkins, stabbing one another, <br>
Is not this trim? is not here goodly things? <br>
That you should be so much accounted of, <br>
I would not else.";"Referring to an earlier, lost <i>Hamlet</i> play (the so-called ""Ur-Hamlet""), which contained the frequently quoted exclamation ""Hamlet, revenge!""";"";"@001080 A Warning for Fair Women";"motif with name";"#005007 MOTIF - Revenge / #005017 MOTIF WITH NAME - Hamlet, revenge";"Character name (main)";"Unmarked";"Tragedy";"";"Dialogue";"Body of text";"Local reference";"Electronic search (HyperHamlet Team)";"@010001-Last accessed 18 September 2007.";"[Comedy:] How some damnd tyrant to obtaine a crowne, <br>
Stabs, hangs, impoysons, smothers, cutteth throats, <br>
And then a Chorus too comes howling in, <br>
And tels vs of the worrying of a cat, <br>
Then of <span class=""quote"">a filthie whining ghost, <br>
Lapt in some fowle sheete, or a leather pelch, <br>
Comes skreaming like a pigge halfe stickt, <br>
And cries Vindicta, reuenge, reuenge: </span><br>
With that a little Rosen flasheth forth, <br>
Like smoke out of a Tabacco pipe, or a boyes squib: <br>
Then comes in two or three like to drouers, <br>
With taylers bodkins, stabbing one another, <br>
Is not this trim? is not here goodly things? <br>
That you should be so much accounted of, <br>
I would not else.";"Anon.  A Warning for Faire Women. As it hath beene lately diuerse times acted by the right Honorable, the Lord Chamberlaine his Seruantes. London: Valentine Sims for William Aspley, 1599.  N.p.; main text, lines 44-58.";"  Hohl Trillini Regula"
" Compounded it with dust, whereto 'tis kin.";"provisional";"William zzzShakespeare";"Henry IV Part 2";"Shakespeare, William.  Henry IV Part 2.  Act 4, scene 5, lines 267-269.";"1597";"1597";"1597";"1597";"English";"[King:] [...] Let all the tears that should bedew my hearse<br>
Be drops of balm to sanctify thy head;<br>
Only <span class=""quote"">compound me with forgotten dust.</span><br>";"";"Lord Chamberlain's (Lord Hunsdon's) Men / The Theatre, London / The Curtain, London";"@001083 Henry IV Part 2";"2-word phrase";"#000293 compounded with dust";"";"Unmarked";"History";"";"Dialogue";"Body of text";"Local reference";"Annotated Shakespeare edition";"@010082
Shakespeare, William. Hamlet. The Oxford Shakespeare. Ed. G. R. Hibbard. Oxford and New York: Oxford University Press, 1994.";"";"";"Quassdorf Sixta"
" with my disposition that this goodly frame, the";"provisional";"William zzzShakespeare";"Henry IV Part 1";"Shakespeare, William.  Henry IV Part 1.  Act, 3, scene 1, lines 13-17.";"1597";"1597";"1597";"1597";"English";"[Glendower:] I cannot blame him. At my nativity<br>
The front of heaven was full of fiery shapes,<br>
Of burning cressets, and at my birth<br>
The <span class=""quote"">frame and huge foundation of the Earth<br></span>
Shaked like a coward.";"";"";"@001059 Henry IV Part 1";"2 keywords";"#000296 goodly frame, the earth";"";"Unmarked";"Theatre";"";"Dialogue";"Body of text";"Local reference";"Annotated Shakespeare edition";"@010082
Shakespeare, William. Hamlet. The Oxford Shakespeare. Ed. G. R. Hibbard. Oxford and New York: Oxford University Press, 1994.";"";"";"Quassdorf Sixta"
" And either [ ] the devil, or throw him out";"provisional";"William zzzShakespeare";"Henry IV Part 1";"Shakespeare, William.  Henry IV Part 1.  Act 3, scene 1, lines 60-61.";"1597";"1597";"1597";"1597";"English";"[Hotspur:] And I can teach thee, coz, to shame the devil<br>
By telling truth. <span class=""quote"">Tell truth and shame the devil.</span>";"";"";"@001059 Henry IV Part 1";"idea";"#000297 shame the devil";"";"Unmarked";"Theatre";"";"Dialogue";"Body of text";"Local reference";"Annotated Shakespeare edition";"@010082
Shakespeare, William. Hamlet. The Oxford Shakespeare. Ed. G. R. Hibbard. Oxford and New York: Oxford University Press, 1994.";"";"";"  Hohl Trillini Regula"
" But he's an arrant knave.";"provisional";"William zzzShakespeare";"Much Ado About Nothing";"Shakespeare, William.  Much Ado About Nothing.  Act 5, scene 1, lines 336-337.";"1598";"1598";"1598";"1598";"English";"[Dogberry:] I leave <span class=""quote"">an arrant knave </span>with your Worship, which I beseech your Worship to correct yourself, for the example of others.";"";"";"@001148 Much Ado About Nothing";"2-word phrase";"#000285 arrant knave";"Unmarked";"Unmarked";"Comedy";"";"Dialogue";"Body of text";"Local reference";"Electronic search (HyperHamlet Team)";"@010001";"";"";"  Hohl Trillini Regula"
" The nights are wholesome; then no planets strike,";"provisional";"Ben zzzJonson";"Every Man In His Humour";"Jonson, Ben.  Every man in his humor. London: Will Stansby 1616.  N.p.; act 4, scene 7, lines 119-121 [normalized spelling].";"1598";"1598";"1598";"1598";"English";"[Bobadill:] […] sure <span class=""quote"">I was struck with a planet </span>thence, for I had no power to touch my weapon. <br>
[Ed. Knowell:]
I, like enough, I have heard of many that have been beaten under a planet: go, get you to a surgeon.";"";"Lord Chamberlain's (Lord Hunsdon's) Men / The Curtain, London";"@001143 Every Man in His Humour";"";"#000204 planets strike";"Unmarked";"Unmarked";"Comedy";"tbe";"Dialogue";"Body of text";"Local reference";"Annotated edition";"@010002-101.";"[Bobadill:] […] sure I was strooke with a plannet thence, for I had no power to touch my weapon. <br>
[Ed. Kno’well:] I, like inough, I haue heard of many that haue beene beaten vnder a plannet: goe, get you to a surgean.";"Jonson, Ben.  Every man in his humor. London: Will Stansby 1616.  N.p.; act 4, scene 7, lines 119-121.";" Heeg Stefanie"
" the rest of my fortunes turn Turk with me--with two";"provisional";"William zzzShakespeare";"Much Ado About Nothing";"Shakespeare, William.  Much Ado About Nothing.  Act 3, scene 4, lines 55-56.";"1598";"1598";"1598";"1598";"English";"[Margaret:] Well, an you be not <span class=""quote"">turned Turk, </span>there's no more sailing by the star.";"";"";"@001148 Much Ado About Nothing";"2-word phrase";"#000183 turn turks";"Unmarked";"Unmarked";"Comedy";"";"Dialogue";"Body of text";"Local reference";"Annotated Shakespeare edition";"@010082
Hibbard, G. R., ed.  William Shakespeare. Hamlet. The Oxford Shakespeare. Oxford and New York: Oxford University Press, 1994.";"";"";"  Hohl Trillini Regula"
" But he's an arrant knave.";"provisional";"William zzzShakespeare";"Much Ado About Nothing";"Shakespeare, William.  Much Ado About Nothing.  Act 3, scene 5, lines 29-31. ";"1598";"1598";"1598";"1598";"English";"[Verges:] Marry, sir, our watch tonight, excepting your Worship's presence, ha' ta'en a couple of as <span class=""quote"">arrant knaves </span> as any in Messina.";"";"";"@001148 Much Ado About Nothing";"2-word phrase";"#000285 arrant knave";"Unmarked";"Unmarked";"Comedy";"";"Dialogue";"Body of text";"Local reference";"Electronic search (HyperHamlet Team)";"@010001-Last accessed 10 September 2010.";"";"";"Tranter Maria"
" Or to take arms against a sea of troubles,";"provisional";"Thomas Rogers";"Quatorzain 12 - Proserpina";"Rogers, Thomas.  ""Quatorzain 12 - Proserpina."" Celestiall Elegies. 1598.  N.p.; lines 1-8 [normalised spelling].";"1598";"1598";"1598";"1598";"HAS SEVERAL LEXIAS!";"From the black kingdom of infernal Dis  [...]<br>
And from the dungeon of the dark abyss,<br>
Wherein the <span class=""quote"">Ocean Seas of troubles slow,</span><br>
I do ascend upon <span class=""quote"">this worldly stage </span>[...].";"";"";"@005038 Quatorzain  ";"2-word phrase";"#000182 PHRASE sea of troubles / #005008 All the world is a stage";"Unmarked";"Unmarked";"Not defined";"tbe";"1st-person narrator";"Body of text";"Local reference";"Electronic search (HyperHamlet Team)";"@010001";"From the black kingdome of infernall Dis  [...]<br>
And from the dungen of the darke abysse,<br>
Wherein the <span class=""quote"">Ocean Seas of troubles slowe,</span>
I doe ascend vpon this worldly stage [...].";"Rogers, Thomas.  ""Quatorzain 12: Proserpina."" Celestiall Elegies. 1598.  N.p.; lines 1-8.";"  Hohl Trillini Regula"
" I should be greeted, if not from Lord Hamlet.";"unedited";"William zzzShakespeare";"Much Ado About Nothing";"Shakespeare, William.  Much Ado About Nothing.  Act 2, scene 1, lines 269-271.";"1598";"1598";"1598";"1598";"English";"[Benedick:] O God, sir, here's a dish I love not! <span class=""quote"">I cannot endure my Lady Tongue.</span>";"";"";"@001148 Much Ado About Nothing";"";"#005166 cannot endure talkative woman";"Unmarked";"Unmarked";"Comedy";"";"Dialogue";"Body of text";"Local reference";"Shakespeare Studies";"@010000-1:179.";"";"";"  Hohl Trillini Regula"
" O my prophetic soul! My uncle!";"provisional";"Sir Francis Hubert";"The Deplorable Life and Death of Edward the Second";"Hubert, Sir Francis.  The Deplorable Life and Death of Edward the Second. 1628. H8 verso; stanza 491. Quoted in: Sayre Greenfield. ""Quoting Hamlet in the Early Seventeenth Century."" Modern Philology 105.3 (2008): 510-534.  532.";"1598";"1600";"1628";"1628";"English";"And <span class=""quote"">my prophetic soul </span>doth truly say [...].";"";"";"@005051 The Deplorable Life and Death of Edward the Second";"2-word phrase";"#000116 PHRASE prophetic soul";"Unmarked";"Unmarked";"Epic and verse narrative";"";"Dialogue";"Body of text";"Local reference";"Shakespeare Studies";"@010005-532.
Greenfield, Sayre. ""Quoting Hamlet in the Early Seventeenth Century."" Modern Philology 105.3 (2008): 510–534.  532.";"And <span class=""quote"">my Propheticke Soul </span>doth truely say [...].";"Hubert, Sir Francis.  The Deplorable Life and Death of Edward the Second. 1628. H8 verso; stanza 491. Quoted in: Sayre Greenfield. ""Quoting Hamlet in the Early Seventeenth Century."" Modern Philology 105.3 (2008): 510–534.  532.";"  Hohl Trillini Regula"
" Take you me for a sponge, my lord?";"provisional";"John zzzMarston";"The Scourge of Villainy";"Marston, John.  ""The Scourge of Villainy."" The scourge of villanie Three bookes of satyres. London: James Roberts for John Busby, 1598.  F3 recto; book 2, satire 7 ""A Cynicke Satyre"" [normalized spelling].";"1598";"1598";"1598";"1598";"English";"He's but a <span class=""quote""><i>sponge,</i> and shortly needs must lease <br>
His wrong got juice, when <i>greatness' fist shall squeeze <br>
His liquor out.</i></span class>";"The idea of flatterers being like sponges comes from Suetonius (cf. reference on HyperHamlet) and became something of a commonplace in Shakespeare's day. Cf. William Shakespeare. Hamlet. The Oxford Shakespeare. Ed. G. R. Hibbard. Oxford and New York: Oxford University Press, 1994. 291; note 11.";"";"@006005 Scourge of Villainy";"image with keyword(s)";"#000077 squeezed sponge";"Unmarked";"Unmarked";"Verse satire";"need to fix biblio and normalised title after transfer";"Narrator";"Body of text";"Local reference";"Annotated Shakespeare edition";"@010082
Shakespeare, William. Hamlet. The Oxford Shakespeare. Ed. G. R. Hibbard. Oxford and New York: Oxford University Press, 1994.";"He's but a <span class=""quote""><i>spunge,</i> and shortly needes must leese <br>
His wrong got iuyce, when <i>greatnes fist shal squeese <br>
His liquor out.</i></span class>";"Marston, John.  The scourge of villanie Three bookes of satyres. London: James Roberts for John Busby, 1598.  F3 recto; book 2, satire 7 ""A Cynicke Satyre"".";"  Hohl Trillini Regula"
" And each particular hair to stand on end,";"provisional";"Josuah Sylvester";"Du Bartas' Divine Weeks and Works";"Du Bartas, Guillaume.  ""Du Bartas' Divine Weeks and Works."" His Divine Weekes and Workes. Trans. Josuah Sylvester. London: Humfray Lownes, 1621.  216, lines 717-22, section ""The Furies"".";"1598";"1598";"1598";"1598";"HAS SEVERAL LEXIAS!";"Then, boyling Wrath, stern, cruell, swift, and rash,<br>
That like a Boar her teeth doth grinde and gnash:<br>
Whose <span class=""quote"">hair doth stare</span>, like <span class=""quote"">bristled Porcupine</span>;<br>
Who som-times rowles her ghastly-glowing eyn,<br>
And som-time fixtly on the ground doth glaunce,<br>
Now bleak, then bloody in her Countenance [...].";"";"";"@005049 Du Bartas Divine Weeks and Works";"image with keyword(s)";"#000268 hair on end / #000396 like a porcupine";"Unmarked";"Unmarked";"Epic and verse narrative";"need to fix biblio and normalised title after transfer";"Narrator";"Body of text";"Local reference";"Electronic search (HyperHamlet Team)";"@010001_Last accessed 23 February 2007.";"";"";"  Hohl Trillini Regula"
" In obstinate condolement is a course";"provisional";"John zzzMarston";"Antonio's Revenge";"Marston, John.  ""Antonios Revenge."" The Plays of John Marston in Three Volumes. Ed. H. Harvey Wood. Edinburgh and London: Oliver and Boyd, 1934-1939. 1:65-134.  132 [normalised spelling].";"1599";"1599";"1599";"1599";"English";"[Andrugio:] [...] Sing <i>Mellida </i>is dead, all hearts will relent <br>
[...] in sad <span class=""quote"">condolement</span> at that heavy sound [...].";"";"";"@001271 Antonios Revenge";"1 keyword";"#000030 condolement";"Unmarked";"Unmarked";"Tragedy";"";"Dialogue";"Body of text";"Local reference";"Electronic search (HyperHamlet Team)";"@010001";"[Andrugio:] [...] Sing <i>Mellida </i>is deade, all hearts will relent <br>
in sad <span class=""quote"">condolement</span> at tha heauie sound [...].";"Marston, John.  ""Antonios Revenge."" The Plays of John Marston in Three Volumes. Ed. H. Harvey Wood. Edinburgh and London: Oliver and Boyd, 1934-1939. 1:65-134.  132.";"  Hohl Trillini Regula"
" I should be greeted, if not from Lord Hamlet.";"unedited";"William zzzShakespeare";"Julius Caesar";"Shakespeare, William.  Julius Caesar.  Act 2, scene 1, line 179.";"1599";"1599";"1599";"1599";"English";"[Brutus:] […] Let's be <span class=""quote"">sacrificers, but not butchers </span>[…].";"";"";"@001198 Julius Caesar";"";"#002155 sacrifice not butcher";"Unmarked";"Unmarked";"Theatre";"";"Dialogue";"Body of text";"Local reference";"Shakespeare Studies";"@010083
Adams, Joseph Quincy, Jr. ""William Heminge and Shakespeare."" Modern Philology 12:1 (May, 1914): 51-64.";"";"";" Heeg Stefanie"
" Thus it remains, and the remainder thus. Perpend.";"provisional";"William zzzShakespeare";"Henry V";"Shakespeare, William.  Henry V.  Act 4, scene 4, line 7-10.";"1599";"1599";"1599";"1599";"English";"[Pistol:] O, Seigneur Dew should be a gentleman. <br>
<span class=""quote"">Perpend my words, </span>O Seigneur Dew, and mark: <br>
O Seigneur Dew, thou diest on point of fox, except, O<br>
Seigneur, thou do give to me egregious ransom.";"";"";"@001183 Henry V";"1 keyword";"#000262 perpend";"Unmarked";"Unmarked";"Theatre";"";"Dialogue";"Body of text";"Local reference";"Electronic search (HyperHamlet Team)";"@010001
LION";"";"";"  Hohl Trillini Regula"
" He was a man, take him for all in all,";"provisional";"William zzzShakespeare";"Julius Caesar";"Shakespeare, William.  Julius Caesar.  Act 5, scene 5, lines 74-81.";"1599";"1599";"1599";"1599";"HAS SEVERAL LEXIAS!";"[Antony:] This was the <span class=""quote"">noblest Roman of them all</span>.<br>
All the conspirators save only he<br>
Did that they did in envy of great Caesar.<br>
He only in a general honest thought<br>
And common good to all made one of them.<br>
His life was gentle and the elements <br>
So mix'd in him that Nature might stand up<br>
And say to all the world <span class=""quote"">""This was a man!"".</span>";"#000168 all in all really lexia?";"";"@001198 Julius Caesar";"sentence or verse line";"#002020 SETPIECE - speech how great sb was / #000168 all in all";"Unmarked";"Unmarked";"Theatre";"QUESTION?!!!";"Dialogue";"Body of text";"Local reference";"Annotated Shakespeare edition";"@010082/@010006
Shakespeare, William. Hamlet. The Oxford Shakespeare. Ed. G. R. Hibbard. Oxford and New York: Oxford University Press, 1994.";"";"";"  Hohl Trillini Regula"
" I should be greeted, if not from Lord Hamlet.";"provisional";"John zzzMarston";"Antonio and Mellida";"Marston, John.  ""Antonio and Mellida."" The Plays of John Marston in Three Volumes. Ed. H. Harvey Wood. Edinburgh and London: Oliver and Boyd, 1934-1939. 1:1-64.  49 [normalised spelling].";"1599";"1599";"1599";"1599";"English";"[Mellida:] [...] well point our speech<br>
With amorous kissing, <span class=""quote"">kissing commas </span>[...].";"";"";"@001218 Antonio and Mellida";"image with keyword(s)";"#000022 comma between love";"Unmarked";"Unmarked";"Comedy";"";"Dialogue";"Body of text";"Local reference";"Annotated edition";"@005134-1:227.
Wood, Harvey,  ed. The Plays of John Marston in Three Volumes. Ed. H. Harvey Wood. Edinburgh and London: Oliver and Boyd, 1934-1939.";"[Mellida:] [...] weele point our speech<br>
With amorous kissing, <span class=""quote"">kissing commaes </span>[...].";"Marston, John.  ""Antonio and Mellida."" The Plays of John Marston in Three Volumes. Ed. H. Harvey Wood. Edinburgh and London: Oliver and Boyd, 1934-1939. 1:1-64.  49.";"  Hohl Trillini Regula"
" I should be greeted, if not from Lord Hamlet.";"unedited";"William zzzShakespeare";"Julius Caesar";"Shakespeare, William.  Julius Caesar.  Act 5, scene 3, lines 99-100.";"1599";"1599";"1599";"1599";"English";"[Titinius:] [...] By your leave, gods, <span class=""quote"">this is a Roman's part. <br></span>
Come, Cassius sword, and find Titinius' heart!";"";"";"@001198 Julius Caesar";"pending";"#005106 a Romans part";"Unmarked";"Unmarked";"Theatre";"";"Dialogue";"Body of text";"Local reference";"Shakespeare Studies";"@010000-1:408.
Munro, John, Clement Mansfield Ingleby et al., eds. The Shakspere Allusion-Book: A Collection of Allusions to Shakspere from 1591 to 1700 [...]. London: Chatto and Windus; New York: Duffield and Co. 1909. 1, 408.";"";"";"  Hohl Trillini Regula"
" That thou, dead corse, again in complete steel";"provisional";"_ 0_Anon";"The Weakest Goeth to the Wall ";"Anon.  The VVeakest goeth to the VVall. As it hath bene sundry times plaide by the right honourable Earle of Oxenford, Lord great Chamberlaine of England his seruants. London: Thomas Creede for Richard Olive 1600.  N.p.; lines 1719-1728 [normalised spelling].";"1599";"1599";"1599";"1599";"English";"[Soldier:] My Lord, <br>
The battle of the Spaniards is dispersed: <br>
Beside, I bring to you this happy news, <br>
The worthy Duke of Boulogne long desired, <br>
And much bewailéd for his injury, <br>
Lives and returned about an hour since.<br> 
At his first coming, <span class=""quote"">armed in complete steel,<br> </span>
Challeng'd the Duke Medyna at his Tent, <br>
And there in single combat like himself, <br>
And like a father of his country's weal, <br>
Hath slain that proud disturber of our peace [...].";"";"Oxford&#039;s Men / Unknown, London";"@001208 The Weakest Goeth to the Wall ";"2-word phrase";"#000271 PHRASE complete steel";"Unmarked";"Unmarked";"Comedy";"";"Dialogue";"Body of text";"Local reference";"Electronic search (HyperHamlet Team)";"@010001-Last accessed 16 October 2010.";"[Soldier:] My Lord, <br>
The battle of the Spaniards is disperst: <br>
Beside, I bring to you this happie newes, <br>
The worthy Duke of Bulloigne long desirde, <br>
And much bewailed for his iniurie, <br>
Liues and returnd about an houre since.<br> 
At his first comming, armd in complete steele,<br> 
Chaleng'd the Duke Medyna at his Tent, <br>
And there in single combat like himselfe, <br>
And like a father of his countreys weale, <br>
Hath slaine that proude disturber of our peace [...].";"Anon.  The VVeakest goeth to the VVall. As it hath bene sundry times plaide by the right honourable Earle of Oxenford, Lord great Chamberlaine of England his seruants. London: Printed by Thomas Creede for Richard Oliue 1600.  N.p.; lines 1719-1728 ";"Tranter Maria"
" And now no soil nor cautel doth besmirch";"provisional";"William zzzShakespeare";"Henry V";"Shakespeare, William.  Henry V.  Act 4, scene 3, lines 115-117.";"1599";"1599";"1599";"1599";"English";"[King Henry:] [...] We are but warriors for the working day;<br>
Our gayness and our gilt are all<span class=""quote""> besmirched</span><br>
With rainy marching in the painful field.";"";"";"@001183 Henry V";"1 keyword";"#001099 besmirch";"Unmarked";"Unmarked";"Theatre";"";"Dialogue";"Body of text";"Local reference";"Annotated Shakespeare edition";"@010082
Shakespeare, William. Hamlet. The Oxford Shakespeare. Ed. G. R. Hibbard. Oxford and New York: Oxford University Press, 1994.";"";"";"Quassdorf Sixta"
" But never the offence. To bear all smooth and even,";"provisional";"William zzzShakespeare";"Henry V";"Shakespeare, William.  Henry V.  Act 2, scene 2, lines 3-5.";"1599";"1599";"1599";"1599";"English";"[Westmoreland:] <span class=""quote"">How smooth and even they do bear themselves,<br></span>
As if allegiance in their bosoms sat<br>
Crownèd with faith and constant loyalty.";"";"";"@001183 Henry V";"3-word phrase";"#000245 bear smooth and even";"Unmarked";"Unmarked";"Theatre";"";"Dialogue";"Body of text";"Local reference";"Annotated Shakespeare edition";"@010082
Shakespeare, William. Hamlet. The Oxford Shakespeare. Ed. G. R. Hibbard. Oxford and New York: Oxford University Press, 1994. ";"";"";"Quassdorf Sixta"
" What art thou that usurp'st this time of night,";"provisional";"William zzzShakespeare";"Julius Caesar";"Shakespeare, William.  Julius Caesar.  Act 4, scene 3, lines 320-324.";"1599";"1599";"1599";"1599";"HAS SEVERAL LEXIAS!";"[Brutus:] [...] Ha, who comes here?<br>
I think it is the weakness of mine eyes<br>
That shapes this monstrous apparition.<br>
It comes upon me. - <span class=""quote"">Art thou any thing</span>?<br>
Art thou some god, some angel, or some devil,<br>
That mak’st my blood cold and my<span class=""quote""> hair to stare</span>?<br>
<span class=""quote"">Speak to me what thou art.</span>";"Brutus speaking to the ghost of Julius Caesar.";"Lord Chamberlain's (Lord Hunsdon's) Men / Globe";"@001198 Julius Caesar";"longer passage";"#000268 hair on end / #000416 what art thou / #001085 I charge thee speak";"Unmarked";"Unmarked";"Tragedy";"";"Dialogue";"Body of text";"Local reference";"Shakespeare Studies";"@010000-1:169./@010084
Munro, John, Clement Mansfield Ingleby et al., eds. The Shakspere Allusion Book: A Collection of Allusions to Shakspere from 1591 to 1700 [...]. London: Chatto and Windus; New York: Duffield and Co., 1909. 1, 169.";"";"";"  Hohl Trillini Regula"
" The graves stood tenantless and the sheeted dead";"provisional";"William zzzShakespeare";"Julius Caesar";"Shakespeare, William.  Julius Caesar.  Act 2, scene 2, line 24.";"1599";"1599";"1599";"1599";"HAS SEVERAL LEXIAS!";"[Calphurnia:] [...] And<span class=""quote""> ghosts</span> did <span class=""quote"">shriek and squeal</span> about the streets.";"";"";"@001198 Julius Caesar";"idea";"#000010 IMAGE - the living dead / #000299 squeak and gibber";"Unmarked";"Unmarked";"Theatre";"";"Dialogue";"Body of text";"Local reference";"Shakespeare Studies / Annotated Shakespeare edition";"@010082/@010030
Shakespeare, William. Hamlet. The Oxford Shakespeare. Ed. G. R. Hibbard. Oxford and New York: Oxford University Press, 1994.<br>
Shaheen, Naseeb. Biblical References in Shakespeare's Tragedies. Newark: University of Delaware Press, 1987. ";"";"";"Quassdorf Sixta"
" I should be greeted, if not from Lord Hamlet.";"unedited";"William zzzShakespeare";"Henry V";"Shakespeare, William.  Henry V.  Act 3, scene 6, line 159.";"1599";"1599";"1599";"1599";"English";"[King Henry:] [...] My ransom is <span class=""quote"">this frail and worthless trunk</sapn> [...].";"";"";"@001183 Henry V";"";"#001179 worthless trunk";"Unmarked";"Unmarked";"Theatre";"";"Dialogue";"Body of text";"Local reference";"Shakespeare Studies";"@010010
Bate, Jonathan et al., eds.William Shakespeare and others: Collaborative Plays. Basingstoke: Palgrave Macmillan, 2013. ";"";"";"Reitzer Elliot"
