"Location";"Status";"Authors";"Title";"Bibliographical reference";"Composition (year_from)";"Composition (year_to)";"First publication (year_from)";"First publication (year_to)";"Language";"Text";"Comment";"General reference";"Line reference";"Overlap/Similarity";"Modifications";"Marking for work";"Marking for author";"Genre";"Subject";"Narrative voice";"Textual functions";"Intertextual relations";"Source";"Bib. ref. source";"URL";"Internal comment";"Contributor"
" Or that the Everlasting had not fix'd";"unedited";"Edmund zzzSpenser";"The Faerie Queene";"Spenser, Edmund.  The Faerie Queene. Eds. Thomas P. Roche and C. Patrick O'Donnell. Harmondsworth: Penguin, 1987. ";"1590";"1590";"1590";"1590";"English";"<span class=""annotation"">In Adonis' garden is word ""<span class=""quote"">everlasting</span>"", the impossibility of complete dissolution, the changing form and fashion in all natural life, the hostility of Time to the flowering herbs and goodly things, and the distinction between reasonable souls and beasts.</span>";"";"";"@005010 The Faerie Queene";"image";"#001135 the Everlasting";"Unmarked";"Unmarked";"Epic and verse narrative";"tbe";"";"Body of text";"Local reference";"Shakespeare Studies";"@010052
Potts, Abbie Findlay. ""Hamlet and Gloriana's Knights."" SQ 6: 1 (Winter 1955): 31-43.";"";"Spenser, Edmund.  The Faerie Queene. Eds. Thomas P. Roche and C. Patrick O'Donnell. Harmondsworth: Penguin, 1987. ";"  Hohl Trillini Regula"
" O, that this too too solid flesh would melt";"provisional";"Edmund zzzSpenser";"The Faerie Queene";"Spenser, Edmund.  The Faerie Queene. Eds. Thomas P. Roche and C. Patrick O'Donnell. Harmondsworth: Penguin, 1987.  438; book 3, canto 4, stanza 26 [normalized spelling].";"1590";"1590";"1590";"1590";"English";"For thy she gave him warning every day,<br>
The love of women not to entertain;<br>
<span class=""quote"">A lesson too too hard for living clay,<br></span>
Form love in course of nature to refrain [...].";"";"";"@005010 The Faerie Queene";"idea with keyword(s)";"#000160 melted flesh, living clay";"Unmarked";"Unmarked";"Epic and verse narrative";"";"Narrator";"Body of text";"Local reference";"Shakespeare Studies";"@010052";"For thy she gaue him warning euery day,<br>
The loue of women not to entertain;<br>
<span class=""quote"">A lesson too too hard for liuing clay,<br></span>
Form loue in course of nature to refraine [...].";"Spenser, Edmund.  The Faerie Queene. Eds. Thomas P. Roche and C. Patrick O'Donnell. Harmondsworth: Penguin, 1987.  438; book 3, canto 4, stanza 26.";"  Hohl Trillini Regula"
" and so I thank you for your good counsel. Come, my";"provisional";"Edmund zzzSpenser";"The Faerie Queene";"Spenser, Edmund.  The Faerie Queene. Eds. Thomas P. Roche and C. Patrick O'Donnell. Harmondsworth: Penguin, 1987.  83; book 1, canto 4, stanza 16 [normalized spelling].";"1590";"1590";"1590";"1590";"English";"[Lucifera] Sudden upriseth from her stately place <br>
The royal Dame, and <span class=""quote"">for her coach doth call </span>[...].";"";"";"@005010 The Faerie Queene";"sentence or verse line";"#000062 goodnight ladies, my coach";"Unmarked";"Unmarked";"Epic and verse narrative";"";"Narrator";"Body of text";"Local reference";"Shakespeare Studies";"@010052
Potts, Abbie Findlay. ""Hamlet and Gloriana’s Knights."" SQ 6.1 (Winter 1955): 31-43. ";"[Lucifera] Suddein vpriseth from her stately place <br>
The royall Dame, and <span class=""quote"">for her coche doth call </span>[...].";"Spenser, Edmund.  The Faerie Queene. Eds. Thomas P. Roche and C. Patrick O'Donnell. Harmondsworth: Penguin, 1987. 83; book 1, canto 4, stanza 16.";"  Hohl Trillini Regula"
" I should be greeted, if not from Lord Hamlet.";"unedited";"Edmund zzzSpenser";"The Faerie Queene";"Spenser, Edmund.  The Faerie Queene. Eds. Thomas P. Roche and C. Patrick O'Donnell. Harmondsworth: Penguin, 1987.  469; book 3, canto 6, stanza 30.";"1590";"1590";"1590";"1590";"English";" <span class=""quote"">flower-garlanded, dew-trickling Medway at her bridal</span>";"";"";"@005010 The Faerie Queene";"motif";"#005016 Young girl distributing flowers";"Unmarked";"Unmarked";"Epic and verse narrative";"tbe";"Narrator";"Body of text";"Local reference";"Shakespeare Studies";"@010052
Potts, Abbie Findlay. ""Hamlet and Gloriana’s Knights."" SQ 6.1 (Winter 1955): 31-43. ";"";"Spenser, Edmund.  The Faerie Queene. Eds. Thomas P. Roche and C. Patrick O'Donnell. Harmondsworth: Penguin, 1987.  ";"  Hohl Trillini Regula"
" thy dowry: be thou as chaste as ice, as pure as";"unedited";"Edmund zzzSpenser";"The Faerie Queene";"Spenser, Edmund.  The Faerie Queene. Eds. Thomas P. Roche and C. Patrick O'Donnell. Harmondsworth: Penguin, 1987.  493; book 3, canto 8, stanza 6.";"1590";"1590";"1590";"1590";"English";"""snowy Florimell"", whose body ""<span class=""quote"">was purest snow in massie mould congeal'd</span>"" and whose face was mingled ""with perfect vermily, That like a lively sanguine it seemed to the eye""";"";"";"@005010 The Faerie Queene";"image";"#002097 as chaste as ice";"Unmarked";"Unmarked";"Epic and verse narrative";"tbe";"Narrator";"Body of text";"Local reference";"Shakespeare Studies";"@010052
Potts, Abbie Findlay. ""Hamlet and Gloriana’s Knights."" SQ 6.1 (Winter 1955): 31-43. ";"""snowy Florimell"", whose body ""was purest snow in massie mould congeal'd"" and whose face was mingled ""with perfect vermily, That like a liuely sanguine it seemd to the eye""";"Spenser, Edmund.  The Faerie Queene. Eds. Thomas P. Roche and C. Patrick O'Donnell. Harmondsworth: Penguin, 1987.  493; book 3, canto 8, stanza 6. ";"  Hohl Trillini Regula"
" marry, marry a fool; for wise men know well enough";"unedited";"Edmund zzzSpenser";"The Faerie Queene";"Spenser, Edmund.  The Faerie Queene. Eds. Thomas P. Roche and C. Patrick O'Donnell. Harmondsworth: Penguin, 1987.  book 3, canto 8, stanza 10, line 7 and book 3, canto 7, stanza 22 and canto 30, stanza 7.";"1590";"1590";"1590";"1590";"English";"[Florimell can] <span class=""quote"">hold a fool in vain delight
<br>
[...]<br>

<span class=""quote"">the Monster </span>";"";"";"@005010 The Faerie Queene";"";"#005261 women making monsters of men";"Unmarked";"Unmarked";"Epic and verse narrative";"tbe";"Narrator";"Body of text";"Local reference";"Shakespeare Studies";"@010052
Potts, Abbie Findlay.  ""Hamlet and Gloriana’s Knights."" SQ 6.1 (Winter 1955): 31-43. ";"[Florimell can]<span class=""quote"">hold a foole in vaine delight
<br>
[...]<br>

<span class=""quote"">the Monster </span>";"Spenser, Edmund.  The Faerie Queene. Eds. Thomas P. Roche and C. Patrick O'Donnell. Harmondsworth: Penguin, 1987.";"  Hohl Trillini Regula"
" beautified Ophelia,'--";"unedited";"Edmund zzzSpenser";"The Faerie Queene";"Spenser, Edmund.  The Faerie Queene. Eds. Thomas P. Roche and C. Patrick O'Donnell. Harmondsworth: Penguin, 1987.  80; book 1, Canto 4, stanza 7 [normalized spelling].";"1590";"1590";"1590";"1590";"English";"And there a noble crew of lords and ladies stood on every side,<br>
which with their presence fair, the place much<span class=""quote""> beautified</span>.";"";"";"@005010 The Faerie Queene";"1 keyword";"#000184 Beautified";"Unmarked";"Unmarked";"Epic and verse narrative";"";"Narrator";"Body of text";"Local reference";"Shakespeare Studies";"@010052
Potts, Abbie Findlay. 'Hamlet and Gloriana's Knights.' Shakespeare Quarterly 6:1 (Winter 1955): 31-43.";"And there a noble crew of lordes and ladies stood on euery side,<br>
which with their presence faire, the place much beautifide.";"Spenser, Edmund.  The Faerie Queene. Eds. Thomas P. Roche and C. Patrick O'Donnell. Harmondsworth: Penguin, 1987.  80; book 1, Canto 4, stanza 7.";"  Hohl Trillini Regula"
" Doth all the noble substance of a doubt";"unedited";"Edmund zzzSpenser";"The Faerie Queene";"Spenser, Edmund.  The Faerie Queene";"1590";"1590";"1590";"1590";"English";"Scudamour's ""dram of hony"" in a similarly fluid metaphor (IV.x.I.I-5): True he it said, what euer man it sayd, That loue with gall and hony doth abound, But if the one be with the other wayd, For euery dram of hony therein found, A pound of gall doth ouer it redound. 
In suggesting ""o'er-redound"" as an emendation for [of a doubt] in Q2 I recall Milton's use of the word with a similar connotation (P.L. VII.56-59): But the evil soon Driv'n back redounded as a flood on those From whom it sprung, impossible to mix With Blessedness ";"";"";"@005010 The Faerie Queene";"";"#001117 dram";"Unmarked";"Unmarked";"Epic and verse narrative";"tbe";"";"";"Local reference";"Shakespeare Studies";"@010052
Potts, Abbie Findlay. ""Hamlet and Gloriana's Knights."" Shakespeare Quarterly 6.1 (Winter 1955): 31-43. ";"";"";"  Hohl Trillini Regula"
" Or to take arms against a sea of troubles,";"provisional";"Sir Everard Digby";"Everard Digby's Dissuasive";"Digby, Everard.  Euerard Digbie His Dissuasiue. London, 1590. 128. Quoted in: Peter Stallybrass. ""Against Thinking."" PMLA 122.5 (2007): 1580-1587.  1581.";"1590";"1590";"1590";"1590";"English";"[...] <span class=""quote"">a sea of troubles</span> [...].";"";"";"@005608 Everard Digbys Dissuasive";"2-word phrase";"#000182 PHRASE sea of troubles";"Unmarked";"Unmarked";"Not specified";"History, (auto-)biography ";"";"Body of text";"Local reference";"Literary and Cultural Studies";"@010079
Stallybrass, Peter. ""Against Thinking."" PMLA 122.5 (2007): 1580-1587.";"";"";"  Hohl Trillini Regula"
" Or to take arms against a sea of troubles,";"provisional";"Edmund zzzSpenser";"The Faerie Queene";"Spenser, Edmund.  The Faerie Queene. Eds. Thomas P. Roche and C. Patrick O'Donnell. Harmondsworth: Penguin, 1987.  128; book 1, canto 7, stanza 39 [normalized spelling].";"1590";"1590";"1590";"1590";"English";"[Una:] What worlds delight, or joy of living speech <br>
Can heart, so plung'd <span class=""quote"">in sea of sorrows deep </span>[...].";"";"";"@005010 The Faerie Queene";"2-word phrase";"#000182 PHRASE sea of troubles";"Unmarked";"Unmarked";"Epic and verse narrative";"";"Narrator";"Body of text";"Local reference";"Shakespeare Studies";"@010052
Potts, Abbie Findlay. ""Hamlet and Gloriana's Knights."" Shakespeare Quarterly 6:1 (Winter 1955): 31-43.";"[Una:] What worlds delight, or ioy of liuing speach <br>
Can heart, so plung'd <span class=""quote"">in sea of sorrowes deepe </span>[...].";"Spenser, Edmund.  The Faerie Queene. Eds. Thomas P. Roche and C. Patrick O’Donnell. Harmondsworth: Penguin, 1987.  128; book 1, canto 7, stanza 39.";"  Hohl Trillini Regula"
" Most lazar-like, with vile and loathsome crust,";"provisional";"Edmund zzzSpenser";"The Faerie Queene";"Spenser, Edmund.  The Faerie Queene. Eds. Thomas P. Roche and C. Patrick O'Donnell. Harmondsworth: Penguin, 1987.  79; book 3, canto 4, stanza 3 [normalized spelling].";"1590";"1590";"1590";"1590";"English";"Great troops of people travelled thitherward<br>
Both day and night, of each degree and place, <br>
But few returned, having scraped hard,<br>
With baleful beggary, or foul disgrace,<br>
Which ever after in most wretched case,<br>
Like <span class=""quote"">loathsome lazars, </span>by the hedges lay.";"";"";"@005010 The Faerie Queene";"2 keywords";"#000254 loathsome + lazar";"Unmarked";"Unmarked";"Epic and verse narrative";"";"Narrator";"Body of text";"Local reference";"Shakespeare Studies";"@010020
Shaheen, Naseeb. Biblical References in Shakespeare's Plays. Newark. University of Delaware Press, 1999.";"Great troupes of people traueild thitherward<br>
Both day and night, of each degree and place, <br>
But few returned, hauing scxaped hard,<br>
With balefull beggerie, or foule disgrace,<br>
Which euer after in most wretched case,<br>
Like <span class=""quote"">loathsome lazars, </span>by the hedges lay.";"Spenser, Edmund.  The Faerie Queene. Eds. Thomas P. Roche and C. Patrick O'Donnell. Harmondsworth: Penguin, 1987.  79; book 3, canto 4, stanza 3.";"  Hohl Trillini Regula"
" And now no soil nor cautel doth besmirch";"provisional";"Henry Swinburne";"Brief Treatise of Testaments and Last Wills";"Swinburne, Henry.  A briefe treatise of testaments and last willes very profitable to be vnderstoode of all the subiects of this realme of England [...]. London: Iohn Windet, 1591.  61, 263 and 265. Quoted in: Kenneth Muir. The Sources of Shakespeare's Plays. London: Methuen, 1977. 169-170 [normalized spelling].";"1590";"1590";"1590";"1590";"English";"[There is] <span class=""quote"">no cautel under heaven, </span>whereby the liberty of making or revoking his testament can be utterly taken away [...] <br>
a man may as oft as he will make a new testament, even until the last breath, <span class=""quote"">nether is there any cautel </span>under the sun to prevent this liberty</span> [...] <span class=""quote"">neither is there any cautel under heaven to prevent this liberty, </span>which also inureth whiles any life endureth.";"";"";"@005001 Swinburne Last Testaments and Wills";"2-word phrase";"#000224 cautel";"Unmarked";"Unmarked";"Not specified";"Politics, law, economics ";"";"Body of text";"Local reference";"Shakespeare Studies";"@010045/@010014
Muir, Kenneth. The Sources of Shakespeare's Plays. London: Methuen, 1977.<br>
Muir, Kenneth. ""Henry Swinburne and Shakespeare."" Notes and Queries 202 (1957): 285-286.";"[There is] <span class=""quote"">no cautele vnder heauen, </span>whereby the libertie of making or reuoking his testament can be ytterly taken away [...] <br>
a man may as oft as hee will make a newe testament, euen vntill the last breath, <span class=""quote"">nether is there any cautele </span>vnder the sunne to preuent this libertie</span> [...] <span class=""quote"">neither is there any cautele vnder heauen to preuent this libertie, </span>which also inureth whiles any life endureth.";"Swinburne, Henry.  A briefe treatise of testaments and last willes very profitable to be vnderstoode of all the subiects of this realme of England [...]. London: Iohn Windet, 1591.  61, 263 and 265. Quoted in: Kenneth Muir. The Sources of Shakespeare's Plays. London: Methuen, 1977. 169-170.";"  Hohl Trillini Regula"
" 'The rugged Pyrrhus, like the Hyrcanian beast,'--";"provisional";"Edmund zzzSpenser";"The Faerie Queene";"Spenser, Edmund.  The Faerie Queene. Eds. Thomas P. Roche and C. Patrick O'Donnell. Harmondsworth: Penguin, 1987.  259; book 2, canto 5, stanza 8.";"1590";"1590";"1590";"1590";"HAS SEVERAL LEXIAS!";"<i>Pyrochles</i> [...] ne car'd for his saufgard,<br><span class=""quote"">But rudely rag'd and like a cruel Tigre far'd.</span>";"";"";"@005010 The Faerie Queene";"pending";"#005050 CLUSTER - Tiger / #002092 rugged beast";"Unmarked";"Unmarked";"Epic and verse narrative";"";"Narrator";"Body of text";"Local reference";"Shakespeare Studies";"@010052/@010070
Potts, Abbie Findlay. ""Hamlet and Gloriana’s Knights."" SQ 6.1 (Winter 1955): 31-43.<br>
Sträuli";"<i>Pyrochles</i> [...] ne car'd for his saufgard,<br><span class=""quote"">But rudely rag'd and like a cruell Tygre far'd.</span>";"Spenser, Edmund.  The Faerie Queene. Eds. Thomas P. Roche and C. Patrick O'Donnell. Harmondsworth: Penguin, 1987.  259; book 2, canto 5, stanza 8.";"  Hohl Trillini Regula"
" Repugnant to command: unequal match'd,";"provisional";"Edmund zzzSpenser";"The Faerie Queene";"Spenser, Edmund.  The Faerie Queene. Eds. Thomas P. Roche and C. Patrick O'Donnell. Harmondsworth: Penguin, 1987.  258; book 2, canto 5, stanza 4.";"1590";"1590";"1590";"1590";"English";"[When Pyrochles is unhorsed, he is compelled]  <span class=""quote"">to matchen equal fight</span> ";"";"";"@005010 The Faerie Queene";"pending";"#002163 Repugnant to command, unequal matched";"Unmarked";"Unmarked";"Epic and verse narrative";"";"Narrator";"Body of text";"Local reference";"Shakespeare Studies";"@010052
Potts, Abbie Findlay. ""Hamlet and Gloriana’s Knights."" SQ 6.1 (Winter 1955): 31-43. ";"";"";"  Hohl Trillini Regula"
" Of reverend Priam, seem'd i' the air to stick:";"provisional";"Edmund zzzSpenser";"The Faerie Queene";"Spenser, Edmund.  The Faerie Queene. Eds. Thomas P. Roche and C. Patrick O'Donnell. Harmondsworth: Penguin, 1987.  304; book 2, canto 8, stanza 30 [normalized spelling].";"1590";"1590";"1590";"1590";"English";"<span class=""annotation"">In the hands of Pyrochles, Arthur's sword Morddure proves <span class=""quote"">rebellious and reluctant</span></span>
Uplifting high, he weened with Morddure, <br> 
His own good sword Morddure, to cleave his head.<br>
The faithful steel such treason no'uld endure, <br>
But swaruing from the mark, his Lords life did assure.";"";"";"@005010 The Faerie Queene";"motif with name";"#002164 rebellious sword";"Unmarked";"Unmarked";"Epic and verse narrative";"check spelling of original text in changed original edition";"Narrator";"Body of text";"Local reference";"Shakespeare Studies";"@010052
Potts, Abbie Findlay. ""Hamlet and Gloriana’s Knights."" SQ 6.1 (Winter 1955): 31-43. ";"<span class=""annotation"">In the hands of Pyrochles, Arthur's sword Morddure proves <span class=""quote"">rebellious and reluctant</span></span>
Vplifting high, he weened with Morddure, <br> 
His owne good sword Morddure, to cleaue his head.<br>
The faithfull steele such treason no'uld endure, <br>
But swaruing from the marke, his Lords life did assure.";"Spenser, Edmund.  The Faerie Queene. Eds. Thomas P. Roche and C. Patrick O'Donnell. Harmondsworth: Penguin, 1987.  304; book 2, canto 8, stanza 30.";"  Hohl Trillini Regula"
" But with the whiff and wind of his fell sword";"provisional";"Edmund zzzSpenser";"The Faerie Queene";"Spenser, Edmund.  The Faerie Queene. Eds. Thomas P. Roche and C. Patrick O'Donnell. Harmondsworth: Penguin, 1987.  126; book 2, canto 7, stanza 31.";"1590";"1590";"1590";"1590";"English";"[Prince Arthur and his horse reel at the] <span class=""quote"">fell </span>[blow of Pyrochles]";"";"";"@005010 The Faerie Queene";"motif with name";"#002165 falling sword or rider";"Character name (main)";"Unmarked";"Epic and verse narrative";"";"Narrator";"Body of text";"Local reference";"Shakespeare Studies";"@010052
Potts, Abbie Findlay. ""Hamlet and Gloriana’s Knights."" SQ 6.1 (Winter 1955): 31-43.";"";"";"  Hohl Trillini Regula"
" Oft breaking down the pales and forts of reason,";"provisional";"Edmund zzzSpenser";"The Faerie Queene";"Spenser, Edmund.  The Faerie Queene. Eds. Thomas P. Roche and C. Patrick O'Donnell. Harmondsworth: Penguin, 1987.  253; book 2, canto 4, stanza 34 [normalized spelling].";"1590";"1590";"1590";"1590";"English";"In their beginning they are weak and wan, <br>
But soon through suff'rance grew to fearful end; <br>
Whiles they are weak betimes with them contend: <br>
For when they once to perfect strength do grow, <br>
Strong wars they make, and cruel battry bend <br>
Gainst <span class=""quote"">fort of Reason, </span>it to overthrow. ";"";"";"@005010 The Faerie Queene";"pending";"#000302 pales and fort of reason";"Unmarked";"Unmarked";"Epic and verse narrative";"";"Narrator";"Body of text";"Local reference";"Shakespeare Studies";"@010052
Potts, Abbie Findlay. ""Hamlet and Gloriana’s Knights."" SQ 6.1 (Winter 1955): 31-43. ";"In their beginning they are weake and wan, <br>
But soone through suff'rance grew to fearefull end; <br>
Whiles they are weake betimes with them contend: <br>
For when they once to perfect strength do grow, <br>
Strong warres they make, and cruell battry bend <br>
Gainst <span class=""quote"">fort of Reason, </span>it to ouerthrow. ";"Spenser, Edmund.  The Faerie Queene. Eds. Thomas P. Roche and C. Patrick O'Donnell. Harmondsworth: Penguin, 1987.  253; book 2, canto 4, stanza 34.";"  Hohl Trillini Regula"
" I should be greeted, if not from Lord Hamlet.";"unedited";"_ 0_Anon";"Mucedorus and Amadine";"Anon.  A Most pleasant Comedie of Mucedorus the Kings sonne of Valentia and Amadine the Kings daughter of Arragon, with the merie conceites of Mouse. Newly set foorth, as it hath bin sundrie times plaide in the honorable Cittie of London. Very delectable and full of mirth. London: William Iones, 1598.  N.p. [spelling normalized]. ";"1591";"1591";"1591";"1591";"English";"[Anselmo:] [...] Or <i>Amadine</i> deserved her high <span class=""quote"">extolment.</span>";"";"Unknown / Unknown, London";"@000884 Mucedorus and Amadine";"";"#001180 extolment";"Unmarked";"Unmarked";"Romance";"tbe";"Dialogue";"Body of text";"Local reference";"Shakespeare Studies";"@010010
Bate, Jonathan,  ed. William Shakespeare and others: Collaborative Plays. Basingstoke: Palgrave Macmillan, 2013. ";"[Anselmo:] [...] Or <i>Amadine</i> deserued her high extolment.";"Anon.  A Most pleasant Comedie of Mucedorus the Kings sonne of Valentia and Amadine the Kings daughter of Arragon, with the merie conceites of Mouse. Newly set foorth, as it hath bin sundrie times plaide in the honorable Cittie of London. Very delectable and full of mirth. London: William Iones, 1598.  N.p.";"Reitzer Elliot"
" I should be greeted, if not from Lord Hamlet.";"provisional";"William zzzShakespeare";"Henry VI Part 3";"Shakespeare, William.  Henry VI Part 3.  Act 5, scene 1, line 42-44.";"1591";"1591";"1591";"1591";"English";"[Richard:] Alas, that Warwick had no more forecast, <br>
But whiles he thought to steal the single ten, <br>
The King was slyly <span class=""quote"">fingered </span>from the deck. ";"";"";"@000902 Henry VI Part 3";"1 keyword";"#000266 fingered";"Unmarked";"Unmarked";"Theatre";"";"Dialogue";"Body of text";"Local reference";"Annotated Shakespeare edition";"@010082
Shakespeare, William. Hamlet. The Oxford Shakespeare. Ed. G. R. Hibbard. Oxford and New York: Oxford University Press, 1994.";"";"";"  Hohl Trillini Regula"
" In equal scale weighing delight and dole,--";"provisional";"William zzzShakespeare";"Henry VI Part 2";"Shakespeare, William.  Henry VI Part 2.  Act 2, scene 1, lines 213-219.";"1591";"1591";"1594";"1594";"English";"[King Henry:] Well, for this night we will repose us here.<br>
Tomorrow toward London back again,<br>
To look into this business thoroughly,<br>
And call these foul offenders to their answers,<br>
And poise the cause in Justice' <span class=""quote"">equal scales,</span><br>
Whose beam stands sure, whose rightful cause<br>
prevails.";"";"";"@000888 Henry VI Part 2";"2-word phrase";"#000290 equal scales";"Unmarked";"Unmarked";"Tragedy";"";"Dialogue";"Body of text";"Local reference";"Annotated Shakespeare edition";"@010082
Shakespeare, William. Hamlet. The Oxford Shakespeare. Ed. G. R. Hibbard. Oxford and New York: Oxford University Press, 1994.";"";"";"  Hohl Trillini Regula"
" I should be greeted, if not from Lord Hamlet.";"provisional";"William zzzShakespeare";"Henry VI Part 2";"Shakespeare, William.  Henry VI Part 2.  Act 2, scene 3, lines 89-95.";"1591";"1591";"1591";"1591";"English";"[Herner:] Masters, I am come hither, as it were, upon my man’s instigation, to prove him a knave and myself an honest man; and touching the Duke of York, I will take my death I never meant him any ill, nor the King, nor the Queen. - And therefore, Peter, <span class=""quote"">have at thee with a downright blow!</span>";"";"";"@000888 Henry VI Part 2";"sentence or verse line";"#000423 have at thee";"";"Unmarked";"Theatre";"";"Dialogue";"Body of text";"Local reference";"Annotated Shakespeare edition";"@010082
Shakespeare, William. Hamlet. The Oxford Shakespeare. Ed. G. R. Hibbard. Oxford and New York: Oxford University Press, 1994.";"";"";"  Hohl Trillini Regula"
" I should be greeted, if not from Lord Hamlet.";"provisional";"William zzzShakespeare";"Henry VI Part 3 ";"Shakespeare, William.  Henry VI Part 3.  Act 2, scene 4, lines 5-11.";"1591";"1591";"1591";"1591";"English";"[Clifford:] Now, Richard, I am with thee here alone. <br>
This is the hand that stabbed thy father York, <br>
And this the hand that slew thy brother Rutland, <br>
And here's the heart that triumphs in their death <br>
And cheers these hands that slew thy sire and brother <br>
To execute the like upon thyself. <br>
<span class=""quote"">And so, have at thee!</span>";"";"";"@000902 Henry VI Part 3";"sentence or verse line";"#000423 have at thee";"Unmarked";"Unmarked";"Theatre";"";"Dialogue";"Body of text";"Local reference";"Annotated Shakespeare edition";"@010082 
Shakespeare, William. Hamlet. The Oxford Shakespeare. Ed. G. R. Hibbard. Oxford and New York: Oxford University Press, 1994.";"";"";"  Hohl Trillini Regula"
" For who would bear the whips and scorns of time,";"unedited";"William zzzShakespeare";"Henry VI Part 2";"Shakespeare, William.  Henry VI Part 2.  Act 4, scene 7, lines 79-80.";"1591";"1591";"1591";"1591";"HAS SEVERAL LEXIAS!";"[Lucy:] Is <span class=""quote"">Talbot </span>slain, the Frenchmen's only <span class=""quote"">scourge,<br>
Your kingdom's terror and black Nemesis?</span>";"";"";"@000888 Henry VI Part 2";"image with keyword(s) / motif with name";"#000005 MOTIF WITH NAME - scourging Nemesis / &002219 HUMAN - John Talbot, 1st Earl of Shrewsbury";"Unmarked";"Unmarked";"Theatre";"";"Dialogue";"Body of text";"Local reference";"Shakespeare Studies";"@010045
Muir, Kenneth. The Sources of Shakespeare's Plays. London: Methuen, 1977.";"";"";"  Hohl Trillini Regula"
" O Jephthah, judge of Israel, what a treasure hadst thou!";"provisional";"William zzzShakespeare";"Henry VI Part 3";"Shakespeare, William.  Henry VI Part 3.  Act 5, scene 1, lines 91-92.";"1591";"1591";"1591";"1591";"HAS SEVERAL LEXIAS!";"[Clarence:] To keep that oath were more impiety<br>
Than <span class=""quote"">Jephthah when he sacrificed his daughter.</span>";"";"";"@000902 Henry VI Part 3";"motif with name";"#000266 MOTIF WITH NAME - Jephthahs daughter / #002255 CHARACTER - Jephthah";"Character name (main)";"Unmarked";"Theatre";"";"Dialogue";"Body of text";"Local reference";"Annotated Shakespeare edition";"@010082
Shakespeare, William. Hamlet. The Oxford Shakespeare. Ed. G. R. Hibbard. Oxford and New York: Oxford University Press, 1994.";"";"";"  Hohl Trillini Regula"
