"Location";"Status";"Authors";"Title";"Bibliographical reference";"Composition (year_from)";"Composition (year_to)";"First publication (year_from)";"First publication (year_to)";"Language";"Text";"Comment";"General reference";"Line reference";"Overlap/Similarity";"Modifications";"Marking for work";"Marking for author";"Genre";"Subject";"Narrative voice";"Textual functions";"Intertextual relations";"Source";"Bib. ref. source";"URL";"Internal comment";"Contributor"
" truepenny?";"provisional";"Nicholas Udall";"Roister Doister";"Udall, Nicholas.  Ralph Roister Doister. Ed. Walter Wilson Greg. London: Malone Society, 1935. Quoted in: Sayre Greenfield. ""Quoting Hamlet in the Early Seventeenth Century."" Modern Philology 105.3 (2008) 510-534.";"1552";"1552";"1552";"1552";"English";"<span class=""quote"">Truepenny</span>";"** This comedy was first performed in London.";"#008000 LONDON_Unknown venue";"@000234 Roister Doister";"Keyword";"NaMa#030074 Truepenny";"Work unmarked";"Author unmarked";"Comedy";"";"Dialogue";"CHARACTERNAME";"Local reference";"Secondary (Academic_Shakespeare)";"@010005
Greenfield, Sayre. ""Quoting Hamlet in the Early Seventeenth Century."" Modern Philology 105.3 (2008): 510-534.";"<span class=""quote"">Truepenie</span>";"";"  Hohl Regula"
" Good my lord, put your discourse into some frame and";"provisional";"Thomas Wilson";"The Art of Rhetoric";"Wilson, Thomas.  The arte of rhetorique for the vse of all suche as are studious of eloquence, sette forth in English, by Thomas Wilson. London: Richard Grafton, 1553.  A2 recto [normalized spelling].";"1553";"1553";"1553";"1553";"English";"Then his sentences must be <span class=""quote"">well framed </span>and his words aptly used <span class=""quote"">through the whole discourse of his Oracion.</span>";"";"";"@005036 The Art of Rhetoric";"";"SuId#030133 framed discourse";"Work unmarked";"Author unmarked";"Nonfiction unspecified";"Linguistics";"Not defined";"BODY OF TEXT";"Local reference";"Secondary (Academic_Shakespeare)";"@010152/@006323-Last accessed 20 February 2020.
Baldwin, Thomas Whitfield. William Shakspere's Small Latine and Lesse Greeke. 2 vols. Urbana: University of Illinois Press, 1944. ";"Then his sentences must be <span class=""quote"">wel framed </span>and his wordes aptly used <span class=""quote"">through the whole discourse of his Oracion.</span>";"Wilson, Thomas.  The arte of rhetorique for the vse of all suche as are studious of eloquence, sette forth in English, by Thomas Wilson. London: Richard Grafton, 1553.  A2 recto.";"  Hohl Regula"
" And by opposing end them? To die: to sleep;";"provisional";"Marcus Tullius Cicero / John Dolman";"Those Five Questions (Tusculanae)";"Dolman, John.  Those fyue questions, which Marke Tullye Cicero, disputed in his manor of Tusculanum: written afterwardes by him, in as manye bookes, to his frende, and familiar Brutus, in the Latine tounge. And nowe, oute of the same translated, & englished, by Iohn Dolman, studente and felowe of the Inner Temple. London: Thomas Marsh, 1561.  G6 recto-G6 verso and H8 recto [normalized spelling].";"1561";"1561";"1561";"1561";"English";"If my sense shall be extinct, and <span class=""quote"">my death resemble sleep, </span>which often without any trouble of dreams, doth bring a man most quiet rest, (O Lord) what pleasure shall death be to me! [...] But if those things be true which are written, namely that <span class=""quote"">death is a departure into those regions, </span>which all they inhabit, that are departed out of this life, then do I account my chance far better, for that, after that I have escaped the hands of you, which sit here in place and name of judges, I shall then come to them which are the true judges, Minos, Rhadamanthus, Aecus, and Triptolemus, and shall there have the company and communication of them which have lived uprightly in the faith and fear of god. This ought to seem a sweet pilgrimage. <br><br>

But <span class=""quote"">if death do utterly destroy us, what can be better, then in the rage of great storms, sweetly to slumber? </span>and after that a man hath nodded out of this life, to sleep everlastingly. ";"** A translation of Marcus Tullius Cicero's <i>Tusculanae disputationes</i>.";"";"@005030 Those Five Questions (Tusculanae)";"";"SuId_NatLan_AbsDea#030087 undiscovered country";"Work unmarked";"Author unmarked";"Nonfiction unspecified";"";"Narrator";"BODY OF TEXT";"Local reference";"Secondary (Academic_Shakespeare)";"@010043";"If my sense shall be extinct, and <span class=""quote"">my death resemble sleep, </span>which often without any trouble of dreams, doth bring a man most quiet rest, (O Lorde) what pleasure shall death be to me! [...] But if those thynges be true whiche are wryten, namely that <span class=""quote"">death is a departure into those regioons, </span>which all they inhabite, that are departed out of this life, then do I accoumpte my chauunce farre better, for that, after that I haue escaped the handes of you, whiche syt here in place and name of iudges, I shall then come to them whiche are the true iudges, Minos, Rhadamanthus, Aecus, and Triptolemus, & shall there haue the companye and communication of them whych haue liued vpryghtly in the faythe and feare of god. This oughte to seeme a sweete pilgrymage. <br><br>

But <span class=""quote"">if death do vtterlye destroye vs, what can be better, then in the rage of great stormes, swetely to slumber? </span>and after that a man hath nodded oute of this lyfe, to sleepe euerlastingly. ";"Dolman, John.  Those fyue questions, which Marke Tullye Cicero, disputed in his manor of Tusculanum: written afterwardes by him, in as manye bookes, to his frende, and familiar Brutus, in the Latine tounge. And nowe, oute of the same translated, & englished, by Iohn Dolman, studente and felowe of the Inner Temple. London: Thomas Marsh, 1561.  G6 recto-G6 verso and H8 recto.";"  Hohl Regula"
" To be, or not to be: that is the question:";"provisional";"Marcus Tullius Cicero / John Dolman";"Those Five Questions (Tusculanae)";"Dolman, John.  Those fyue questions, which Marke Tullye Cicero, disputed in his manor of Tusculanum: written afterwardes by him, in as manye bookes, to his frende, and familiar Brutus, in the Latine tounge. And nowe, oute of the same translated, & englished, by Iohn Dolman, studente and felowe of the Inner Temple. London: Thomas Marsh, 1561.  B6 verso [normalized spelling].";"1561";"1561";"1561";"1561";"English";"Perchance I have not told you all that I think; for <span class=""quote"">not to be when you have been, </span>I think is the greatest misery that may be. ";"";"";"@005030 Those Five Questions (Tusculanae)";"";"WoSn#030065 to x or not to x";"Work unmarked";"Author unmarked";"Nonfiction unspecified";"Philosophy, religion";"First-person narrator";"BODY OF TEXT";"Local reference";"Secondary (Academic_Shakespeare)";"@010043/@010042/@006323-Last accessed 20 February 2020.

Vickers, Brian. ""Hamlet and Cicero."" Unpublished manuscript article. <br>
Velz, John V. Shakespeare and the Classical Tradition: A Critical Guide to Commentary, 1660-1960. Minneapolis: University of Minnesota Press, 1968.";"Perchaunce I have not tolde you all that I thinke; for <span class=""quote"">not to be when you have bene, </span>I thinke is the greatest misery that may be. ";"Dolman, John.  Those fyue questions, which Marke Tullye Cicero, disputed in his manor of Tusculanum: written afterwardes by him, in as manye bookes, to his frende, and familiar Brutus, in the Latine tounge. And nowe, oute of the same translated, & englished, by Iohn Dolman, studente and felowe of the Inner Temple. London: Thomas Marsh, 1561.  B6 verso.";"  Hohl Regula"
" To be, or not to be: that is the question:";"provisional";"Marcus Tullius Cicero / John Dolman";"Those Five Questions (Tusculanae)";"Dolman, John.  Those fyue questions, which Marke Tullye Cicero, disputed in his manor of Tusculanum: written afterwardes by him, in as manye bookes, to his frende, and familiar Brutus, in the Latine tounge. And nowe, oute of the same translated, & englished, by Iohn Dolman, studente and felowe of the Inner Temple. London: Thomas Marsh, 1561.  B7 recto [normalized spelling]. ";"1561";"1561";"1561";"1561";"English";"[...] <span class=""quote"">they be not as they have been</span> [...].";"";"";"@005030 Those Five Questions (Tusculanae)";"";"WoSn#030065 to x or not to x";"Work unmarked";"Author unmarked";"Nonfiction unspecified";"Philosophy, religion";"Narrator";"BODY OF TEXT";"Local reference";"Secondary (Academic_Shakespeare)";"@010042/@010043

Vickers, Brian. ""Hamlet and Cicero."" Unpublished manuscript.<br>
Velz, John V. Shakespeare and the Classical Tradition: A Critical Guide to Commentary, 1660-1960. Minneapolis: University of Minnesota Press, 1968.";"[...] <span class=""quote"">they be not as they have bene</span> [...].";"Dolman, John.  Those fyue questions, which Marke Tullye Cicero, disputed in his manor of Tusculanum: written afterwardes by him, in as manye bookes, to his frende, and familiar Brutus, in the Latine tounge. And nowe, oute of the same translated, & englished, by Iohn Dolman, studente and felowe of the Inner Temple. London: Thomas Marsh, 1561.  B7 recto. ";"  Hohl Regula"
" To be, or not to be: that is the question:";"provisional";"Marcus Tullius Cicero / John Dolman";"Those Five Questions (Tusculanae)";"Dolman, John.  Those fyue questions, which Marke Tullye Cicero, disputed in his manor of Tusculanum: written afterwardes by him, in as manye bookes, to his frende, and familiar Brutus, in the Latine tounge. And nowe, oute of the same translated, & englished, by Iohn Dolman, studente and felowe of the Inner Temple. London: Thomas Marsh, 1561.  B7 verso.";"1561";"1561";"1561";"1561";"English";"[...] whatsoever you do so pronounce must not <span class=""quote"">either be or not be.</span>";"";"";"@005030 Those Five Questions (Tusculanae)";"";"WoSn#030065 to x or not to x";"Work unmarked";"Author unmarked";"Nonfiction unspecified";"Philosophy, religion";"Narrator";"BODY OF TEXT";"Local reference";"Secondary (Academic_Shakespeare)";"@010043/@010042/@006323-Last accessed 20 February 2020.

Vickers, Brian. ""Hamlet and Cicero."" Unpublished manuscript.<br>
Velz, John W. Shakespeare and the Classical Tradition: A Critical Guide to Commentary, 1660-1960. Minneapolis: University of Minnesota Press, 1968.";"";"";"  Hohl Regula"
" So I do still, by these pickers and stealers.";"provisional";"_ Anon";"The Book of Common Prayer";"Anon.  The booke of common prayer, and administration of the sacramentes and other rites and ceremonies in the Churche of England. London: Richardi Iugge and Iohannis Cawood, 1562.  328 [normalized spelling].";"1562";"1562";"1562";"1562";"English";"Keep my hands from <span class=""quote"">picking and stealing, </span>and my tongue from evil speaking, lying and slandering.";"";"";"@005043 The Book of Common Prayer";"";"WoTo#030135 picking and stealing";"Work unmarked";"Author unmarked";"Pamphlet or liturgical text";"Philosophy, religion";"First-person narrator";"BODY OF TEXT";"Local reference";"Secondary (Academic_Shakespeare)";"@010030/@006323-Last accessed 20 February 2020.
Shaheen, Naseeb.  Biblical References in Shakespeare's Tragedies. Newark: University of Delaware Press, 1987. ";"Kepe my handes from <span class=""quote"">picking and stealing, </span>and my tongue from evill speaking, lying and slandring.";"Thomas Cranmer,  ed. The booke of the common prayer and administracion of the sacramentes : and other rites and ceremonies of the Churche : after the vse of the Churche of England. London: Edouardi Whitechurche 1549.  326.";"  Hohl Regula"
" I should be greeted, if not from Lord Hamlet.";"unedited";"_ Anon";"The Book of Common Prayer";"Anon.  The booke of common prayer, and administration of the sacramentes and other rites and ceremonies in the Churche of England. London: Richardi Iugge and Iohannis Cawood, 1562.  356; section ""Burial Service"" [normalized spelling].";"1562";"1562";"1562";"1562";"English";"[...] <span class=""quote"">we therefore commit this body to the ground earth to earth, ashes to ashes, dust to dust, </span> [...].";"";"";"@005043 The Book of Common Prayer";"";"WoPh#230118 ashes to ashes";"Work unmarked";"Author unmarked";"Pamphlet or liturgical text";"Philosophy, religion";"Narrator";"BODY OF TEXT";"Local reference";"Secondary (Academic_Shakespeare)";"@010151";"[...] <span class=""quote"">we therefore committe this bodie to the ground earth to earthe, ashes to ashes, duste to dust, </span> [...].";"Anon.  The booke of common prayer, and administration of the sacramentes and other rites and ceremonies in the Churche of England. London: Richardi Iugge and Iohannis Cawood, 1562.  356; section ""Burial Service"".";"  Hohl Regula"
" I should be greeted, if not from Lord Hamlet.";"provisional";"_ Anon";"The Book of Common Prayer";"Church of England.  The booke of common prayer, and administration of the sacramentes and other rites and ceremonies in the Churche of England. London: Richardi Iugge and Iohannis Cawood, 1562.  360; section ""Burial Service"" [normalized spelling].";"1562";"1562";"1562";"1562";"English";"[...] <span class=""quote"">delivered from the burden of the flesh </span>[...] </span class=""quote"">in joy and felicity.</span>";"";"";"@005043 The Book of Common Prayer";"";"WoPh#032169 felicity";"Work unmarked";"Author unmarked";"Pamphlet or liturgical text";"Philosophy, religion";"Narrator";"BODY OF TEXT";"Local reference";"Secondary (Academic_Shakespeare)";"@010030
Shaheen, Naseeb. Biblical References in Shakespeare's Tragedies. Newark: University of Delaware Press, 1987. ";"[...] deliuered from the burden of the flesh [...] in ioy and felicitie";"Church of England.  The booke of common prayer, and administration of the sacramentes and other rites and ceremonies in the Churche of England. London: Richardi Iugge and Iohannis Cawood, 1562.  360; section ""Burial Service"".";"  Hohl Regula"
" Or to take arms against a sea of troubles,";"provisional";"_ Anon";"The Book of Common Prayer";"Church of England.  The booke of common prayer, and administration of the sacramentes and other rites and ceremonies in the Churche of England. London: Richardi Iugge and Iohannis Cawood, 1562.  310; section ""Publique Baptism"" [normalised spelling].";"1562";"1562";"1562";"1562";"English";"[...] May so pass <span class=""quote"">the waves of this troublesome world</span> [...].";"";"";"@005043 The Book of Common Prayer";"";"WoPh#030067 sea of troubles";"Work unmarked";"Author unmarked";"Pamphlet or liturgical text";"Philosophy, religion";"Narrator";"BODY OF TEXT";"Local reference";"Secondary (Academic_Shakespeare)";"@010082/@006323-Last accessed 20 February 2020.
Shaheen, Naseeb. Biblical References in Shakespeare's Tragedies. Newark: University of Delaware Press, 1987. ";"May so passe <span class=""quote"">the waues of this troublesome world</span>";"Church of England.  ""Publique Baptism"". The booke of common prayer, and administration of the sacramentes and other rites and ceremonies in the Churche of England. London: Richardi Iugge and Iohannis Cavvood, 1562.  308-316.  310.";"  Hohl Regula"
" Like Niobe, all tears:--why she, even she--";"provisional";"Richard Rainolde";"The Foundation of Rhetoric";"Rainolde, Richard.  Foundacion of Rhetorike. 1563. Quoted in Louise Schleiner. ""Latinized Greek Drama in Shakespeare's Writing of Hamlet."" Shakespeare Quarterly 41.1 (Spring 1990): 29-48.  30.";"1563";"1563";"1563";"1563";"English";"<span class=""annotation"">Discusses the story of <span><span class=""quote"">Niobe </span><span class=""annotation"">by way of showing how to devise a lament from Niobe's perspective.</span>";"";"";"@005038 The Foundation of Rhetoric";"";"NaMa#030183 Niobe, all tears / NaCa#032242 Niobe";"Work by character";"Author unmarked";"Nonfiction unspecified";"Linguistics";"Narrator";"BODY OF TEXT";"";"Secondary (Academic_Shakespeare)";"@010224/@006323-Last accessed 20 February 2020.
Schleiner, Louise. ""Latinized Greek Drama in Shakespeare's Writing of Hamlet."" Shakespeare Quarterly 41.1 (Spring 1990): 29-48.";"";"";"  Hohl Regula"
" Or to take arms against a sea of troubles,";"provisional";"Henry  Smith";"The Trials of the Righteous";"Smith, Henry.  The Sermons of Master Henry Smith, gathered into one volume. Printed according to his corrected copies in his life time. London: F. Kyngston, for T. Man 1607.  230-245, esp. 235; ""The Trial of the Righteous"" [normalized spelling].";"1565";"1565";"1565";"1565";"English";"[...] you must go through <span class=""quote"">a sea of troubles, </span>and then that you shall come to a heaven of rest [...]";"";"";"@005044 Sermons (Smith)";"";"WoPh#030067 sea of troubles";"Work unmarked";"Author unmarked";"Speech or lecture or sermon";"Philosophy, religion";"Narrator";"BODY OF TEXT";"Local reference";"Secondary (Academic_Shakespeare)";"@010082/@006323-Last accessed 20 February 2020.
Shaheen, Naseeb. Biblical References in Shakespeare's Tragedies. Newark: University of Delaware Press, 1987. ";"you must goe through <span class=""quote"">a sea of troubles, </span>and then that you shall come to a heauen of rest";"Smith, Henry.  The Sermons of Master Henry Smith, gathered into one volume. Printed according to his corrected copies in his life time. London: F. Kyngston, for T. Man 1607.  230-245, esp. 235; ""The Trial of the Righteous"".";"  Hohl Regula"
" Rich gifts wax poor when givers prove unkind.";"provisional";"George Buchanan";"Pompae Deorum Rusticorum";"Buchanan, George.  ""Pompae deorum rusticorum. Or The Masque of the Rustic Gods Bearing Gifts for James VI and His Mother Mary, the Sovereigns of Scotland, at the Banquet Following the King's Baptism."" Quoted from: Peter Davidson. ""The entry of Mary Stewart into Edinburgh, 1561, and Other Ambiguities."" Renaissance Studies 9.4 France in the English and French Theatre of theRenaissance (December 1995): 416-429, esp. 426-429.  426; lines 32-34.";"1566";"1566";"1566";"1566";"Latin";"[Naiades:] Haec damus tibi, nec tamen pusilla,<br>
<span class=""quote"">Si non munere pectus aestimentur,<br> 
Verum e pectore munus aestimetur.<br></span>";"* Translation given in the quoted edition: And yet these gifts are not trifles, if the heart's love is not measured by the value of the gift, but the gift's value by the love in the heart.";"";"@000439 Pompae Deorum Rusticorum";"";"SuMe#032173 value gifts and kindness";"Work unmarked";"Author unmarked";"Masque or other";"";"Dialogue";"BODY OF TEXT";"Local reference";"Secondary (Academic_Shakespeare)";"@010151
Theobald, W. M.  The Classical Element in the Shakespeare Plays. London: Robert Banks, 1909. ";"";"";"  Hohl Regula"
" I should be greeted, if not from Lord Hamlet.";"unedited";"Lucius Annaeus Seneca / John Studley";"Hercules Oetaeus";"Studley, John and Lucius Annaeus Seneca.  ""Hercules Oetaeus."" Seneca. His Tenne Tragedies. Translated into Englysh. London: Thomas Marshe, 1581.  187 recto-217 verso.  215 recto; act 5 [normalized spelling].";"1566";"1566";"1566";"1566";"English";"[Oeneus:] [...] If any tyrant feed his boars with gobs of strangers' flesh <br>
Now let <span class=""quote"">his pampered jades </span>unto my Carcass fall afresh.	";"";"#008000 LONDON_Unknown venue";"@000426 Hercules Oetaeus";"";"WoPh_NatAni#030005 pampered jades";"Work unmarked";"Author unmarked";"Tragedy";"";"Dialogue";"BODY OF TEXT";"Local reference";"Electronic search (Fulltext database_Literature)";"@010001";"[Oeneus:] [...] If any tyrant feede his borce with gubbes of straungers flesh <br>
Now let his pampred iades vnto my Carksse fall a fresh.";"Studley, John and Lucius Annaeus Seneca.  ""Hercules Oetaeus."" Seneca. His Tenne Tragedies. Translated into Englysh. London: Thomas Marshe, 1581.  187 recto-217 verso.  215 recto; act 5.";"  Hohl Regula"
" beautified Ophelia,'--";"provisional";"William Painter";"The Palace of Pleasure";"Painter, William.  The Palace of Pleasure: Beautified, adorned and well furnished, with Pleasaunt Histories and excellent Nouelles, selected out of diuers good and commendable Authors. London: Henry Denham for Richard Tottell and William Iones, 1566. 251-277.  257 [normalized spelling].";"1566";"1566";"1566";"1566";"English";"The Palace of Pleasure: <span class=""quote"">Beautified, </span>adorned and well furnished, with Pleasant Histories and excellent Novels, selected out of diverse good and commendable Authors. ";"";"";"@005032 The Palace of Pleasure";"Keyword";"WoMo#030217 beautified";"Work unmarked";"Author unmarked";"Prose unspecified";"";"";"TITLE";"Local reference";"Electronic search (Fulltext database_Literature)";"@010001";"The Palace of Pleasure: <span class=""quote"">Beautified, </span>adorned and well furnished, with Pleasaunt Histories and excellent Nouelles, selected out of diuers good and commendable Authors. ";"Painter, William.  The Palace of Pleasure: Beautified, adorned and well furnished, with Pleasaunt Histories and excellent Nouelles, selected out of diuers good and commendable Authors. London: Henry Denham for Richard Tottell and William Iones, 1566. 251-277.  257. ";"  Hohl Regula"
" Or to take arms against a sea of troubles,";"provisional";"William Painter";"The Palace of Pleasure";"Painter, William.  The Palace of Pleasure. Beautified, adorned and well furnished, with Pleasaunt Histories and excellent Nouelles, selected out of diuers good and commendable Authors. London: Henry Denham for Richard Tottell and William Iones, 1566. 251-277.  257 [normalized spelling]. ";"1566";"1566";"1566";"1566";"English";"I feel (alas) a diversity of anguishes, and <span class=""quote"">a Sea of troubles</span>, which torment my mind and yet, I dare not discover the occasion [...].";"";"";"@005032 The Palace of Pleasure";"";"WoPh#030067 sea of troubles";"Work unmarked";"Author unmarked";"Prose unspecified";"";"First-person narrator";"BODY OF TEXT";"Local reference";"Secondary (Academic_Literature)";"@010079/@006323-Last accessed 20 February 2020.
Stallybrass, Peter. ""Against Thinking."" PMLA 122.5 (2007): 1580-1587.";"I feele (alas) a diuersitie of anguishes, & <span class=""quote"">a Sea of troubles</span>, whiche tormente my minde & yet, I dare not discouer the occasion [...].";"Painter, William.  The Palace of Pleasure: Beautified, adorned and well furnished, with Pleasaunt Histories and excellent Nouelles, selected out of diuers good and commendable Authors. London: Henry Denham for Richard Tottell and William Iones, 1566. 251-277.  257.";"  Hohl Regula"
" O, what a rogue and peasant slave am I!";"provisional";"Lucius Annaeus Seneca / John Studley";"Hercules Oetaeus";"Studley, John and Lucius Annaeus Seneca.  ""Hercules Oetaeus."" Seneca. His Tenne Tragedies. Translated into Englysh. London: Thomas Marshe, 1581.  187 recto-217 verso.  214 recto; act 5 [normalized spelling].";"1566";"1566";"1566";"1566";"English";"[Philoctetes:] [...] O coward, <span class=""quote"">peasant slave</span><br>
Thou art too weak to bend my bow, unmeet my shafts to have<br>
What ailest thou to look so pale [...]?";"";"";"@000426 Hercules Oetaeus";"";"WoPh#034463 peasant slave";"Work unmarked";"Author unmarked";"Tragedy";"";"Dialogue";"BODY OF TEXT";"Local reference";"Secondary (Academic_Shakespeare)";"@010071/@006323-Last accessed 20 February 2020.
Taylor, Anthony Brian.  ""Shakespeare, Studley, and Golding."" The Review of English Studies 39.156 (1988): 522–527. ";"[Philoctetes:] [...] O coward, peasant slave<br>
Thou art to weake to bende my bow, unmete my shaftes to have<br>
What aylest thou to loke so pale [...].";"Studley, John and Lucius Annaeus Seneca.  ""Hercules Oetaeus."" Seneca. His Tenne Tragedies. Translated into Englysh.  115-118; act 1.";"  Hohl Regula"
" I must be cruel, only to be kind:";"provisional";"Arthur Golding / Publius Ovidius Naso";"Ovids Metamorphoses";"Golding, Arthur and Publius Ovidius Naso.  The xv Bookes of P. Ouidius Naso, entytuled Metamorphosis, translated oute of Latin into English meeter, by Arthur Golding [...]. A worke very pleasaunt and delectable. London: William Seres, 1567.  30 recto; book 3, line 7 [normalized spelling].";"1567";"1567";"1567";"1567";"English";"For which he might both justly <span class=""quote"">kind and cruel called be. </span>";"";"";"@005282 Ovid's Metamorphoses (Golding)";"";"WoKw#230119 cruel to be kind";"Work unmarked";"Author unmarked";"Epic and verse narrative";"";"Narrator";"BODY OF TEXT";"Local reference";"Electronic search (Fulltext database_Literature)";"@010001";"For which he might both iustly <span class=""quote"">kinde and cruell called bee. </span>";"Golding, Arthur and Publius Ovidius Naso.  The xv Bookes of P. Ouidius Naso, entytuled Metamorphosis, translated oute of Latin into English meeter, by Arthur Golding [...]. A worke very pleasaunt and delectable. London: William Seres, 1567.  30 recto; book 3, line 7.";"Quassdorf Sixta"
