"Location";"Status";"Authors";"Title";"Bibliographical reference";"Composition (year_from)";"Composition (year_to)";"First publication (year_from)";"First publication (year_to)";"Language";"Text";"Comment";"General reference";"Line reference";"Overlap/Similarity";"Modifications";"Marking for work";"Marking for author";"Genre";"Subject";"Narrative voice";"Textual functions";"Intertextual relations";"Source";"Bib. ref. source";"URL";"Internal comment";"Contributor"
" But with the whiff and wind of his fell sword";"provisional";"Edmund Spenser";"The Faerie Queene";"Spenser, Edmund.  The Faerie Queene. Eds. Thomas P. Roche and C. Patrick O'Donnell. Harmondsworth: Penguin, 1987.  126; book 2, canto 7, stanza 31.";"1590";"1590";"1590";"1590";"English";"[Prince Arthur and his horse reel at the] <span class=""quote"">fell </span>[blow of Pyrochles]";"";"";"@005017 The Faerie Queene";"";"WoKw_CulWar#032165 fell sword";"Work by character";"Author unmarked";"Epic and verse narrative";"";"Narrator";"BODY OF TEXT";"";"Secondary (Academic_Shakespeare)";"@010052
Potts, Abbie Findlay. ""Hamlet and Gloriana’s Knights."" SQ 6.1 (Winter 1955): 31-43.";"";"";"  Hohl Regula"
" Oft breaking down the pales and forts of reason,";"provisional";"Edmund Spenser";"The Faerie Queene";"Spenser, Edmund.  The Faerie Queene. Eds. Thomas P. Roche and C. Patrick O'Donnell. Harmondsworth: Penguin, 1987.  253; book 2, canto 4, stanza 34 [normalized spelling].";"1590";"1590";"1590";"1590";"English";"In their beginning they are weak and wan, <br>
But soon through sufferance grew to fearful end; <br>
Whiles they are weak betimes with them contend: <br>
For when they once to perfect strength do grow, <br>
Strong wars they make, and cruel battery bend <br>
'Gainst <span class=""quote"">fort of Reason, </span>it to overthrow. ";"";"";"@005017 The Faerie Queene";"";"WoPh_CulWar#030302 pales and fort of reason";"Work unmarked";"Author unmarked";"Epic and verse narrative";"";"Narrator";"BODY OF TEXT";"Local reference";"Secondary (Academic_Shakespeare)";"@010052
Potts, Abbie Findlay. ""Hamlet and Gloriana’s Knights."" SQ 6.1 (Winter 1955): 31-43. ";"In their beginning they are weake and wan, <br>
But soone through suff'rance grew to fearefull end; <br>
Whiles they are weake betimes with them contend: <br>
For when they once to perfect strength do grow, <br>
Strong warres they make, and cruell battry bend <br>
Gainst <span class=""quote"">fort of Reason, </span>it to ouerthrow. ";"Spenser, Edmund.  The Faerie Queene. Eds. Thomas P. Roche and C. Patrick O'Donnell. Harmondsworth: Penguin, 1987.  253; book 2, canto 4, stanza 34.";"  Hohl Regula"
" I should be greeted, if not from Lord Hamlet.";"provisional";"William Shakespeare";"Henry VI Part 3";"Shakespeare, William.  <i>Henry VI Part 3. </i> Act 5, scene 1, line 42-44.";"1591";"1591";"1591";"1591";"English";"[Richard:] Alas, that Warwick had no more forecast, <br>
But whiles he thought to steal the single ten, <br>
The King was slyly <span class=""quote"">fingered </span>from the deck. ";"** This history play was first performed iin 1591.";"";"@000902_A91_D95 Henry VI Part 3";"";"WoMo#030266 fingered";"Work unmarked";"Author unmarked";"History";"";"Dialogue";"BODY OF TEXT";"Local reference";"Secondary (Annotated edition_Shakespeare)";"@010082/@006323-Last accessed 10 March 2020.
Shakespeare, William. Hamlet. The Oxford Shakespeare. Ed. G. R. Hibbard. Oxford and New York: Oxford University Press, 1994.";"";"";"  Hohl Regula"
" In equal scale weighing delight and dole,--";"provisional";"William Shakespeare";"Henry VI Part 2";"Shakespeare, William.  Henry VI Part 2.  Act 2, scene 1, lines 213-219.";"1591";"1591";"1594";"1594";"English";"[King Henry:] Well, for this night we will repose us here.<br>
Tomorrow toward London back again,<br>
To look into this business thoroughly,<br>
And call these foul offenders to their answers,<br>
And poise the cause in Justice' <span class=""quote"">equal scales,</span><br>
Whose beam stands sure, whose rightful cause<br>
prevails.";"";"";"@000888_A91_D23 Henry VI Part 2";"";"WoPh#030146 equal scales";"Work unmarked";"Author unmarked";"Tragedy";"";"Dialogue";"BODY OF TEXT";"Local reference";"Secondary (Annotated edition_Shakespeare)";"@010082/@006323-Last accessed 10 March 2020.
Shakespeare, William. Hamlet. The Oxford Shakespeare. Ed. G. R. Hibbard. Oxford and New York: Oxford University Press, 1994.";"";"";"  Hohl Regula"
" I should be greeted, if not from Lord Hamlet.";"provisional";"William Shakespeare";"Henry VI Part 2";"Shakespeare, William.  Henry VI Part 2.  Act 2, scene 3, lines 89-95.";"1591";"1591";"1591";"1591";"English";"[Herner:] Masters, I am come hither, as it were, upon my man’s instigation, to prove him a knave and myself an honest man; and touching the Duke of York, I will take my death I never meant him any ill, nor the King, nor the Queen. - And therefore, Peter, <span class=""quote"">have at thee with a downright blow!</span>";"";"";"@000888_A91_D23 Henry VI Part 2";"";"WoPh#030423 have at thee";"Work unmarked";"Author unmarked";"Theatre";"";"Dialogue";"BODY OF TEXT";"Local reference";"Secondary (Annotated edition_Shakespeare)";"@010082/@006323-Last accessed 10 March 2020.
Shakespeare, William. Hamlet. The Oxford Shakespeare. Ed. G. R. Hibbard. Oxford and New York: Oxford University Press, 1994.";"";"";"  Hohl Regula"
" I should be greeted, if not from Lord Hamlet.";"provisional";"William Shakespeare";"Henry VI Part 3 ";"Shakespeare, William.  Henry VI Part 3.  Act 2, scene 4, lines 5-11.";"1591";"1591";"1591";"1591";"English";"[Clifford:] Now, Richard, I am with thee here alone. <br>
This is the hand that stabbed thy father York, <br>
And this the hand that slew thy brother Rutland, <br>
And here's the heart that triumphs in their death <br>
And cheers these hands that slew thy sire and brother <br>
To execute the like upon thyself. <br>
<span class=""quote"">And so, have at thee!</span>";"";"";"@000902_A91_D95 Henry VI Part 3";"";"WoPh#030423 have at thee";"Work unmarked";"Author unmarked";"Theatre";"";"Dialogue";"BODY OF TEXT";"Local reference";"Secondary (Annotated edition_Shakespeare)";"@010082/@006323-Last accessed 10 March 2020.
Shakespeare, William. Hamlet. The Oxford Shakespeare. Ed. G. R. Hibbard. Oxford and New York: Oxford University Press, 1994.";"";"";"  Hohl Regula"
" For who would bear the whips and scorns of time,";"provisional";"William Shakespeare";"Henry VI Part 2";"Shakespeare, William.  Henry VI Part 2.  Act 4, scene 7, lines 79-80.";"1591";"1591";"1591";"1591";"English";"[Lucy:] Is <span class=""quote"">Talbot </span>slain, the <span class=""quote"">Frenchmen's only scourge,<br>
Your kingdom's terror and black Nemesis?</span>";"";"";"@000888_A91_D23 Henry VI Part 2";"";"NaMa#030083 scourging Nemesis / NaHu#007010 John Talbot, 1st Earl of Shrewsbury / NaMa#004196 Talbot the terror of the French";"Work by character";"Author unmarked";"Theatre";"";"Dialogue";"BODY OF TEXT";"";"Secondary (Academic_Shakespeare)";"@010045/@010200-166.
Muir, Kenneth. The Sources of Shakespeare's Plays. London: Methuen, 1977.";"";"";"  Hohl Regula"
" O Jephthah, judge of Israel, what a treasure hadst thou!";"provisional";"William Shakespeare";"Henry VI Part 3";"Shakespeare, William.  Henry VI Part 3.  Act 5, scene 1, lines 91-92.";"1591";"1591";"1591";"1591";"English";"[Clarence:] To keep that oath were more impiety<br>
Than <span class=""quote"">Jephthah when he sacrificed his daughter.</span>";"";"";"@000902_A91_D95 Henry VI Part 3";"";"NaMa#330011 Jephthah's daughter / NaCa#032255 Jephthah";"Work by character";"Author unmarked";"Theatre";"";"Dialogue";"BODY OF TEXT";"MQ_VERBAL_likeas";"Secondary (Annotated edition_Shakespeare)";"@010082/@006323-Last accessed 10 March 2020.
Shakespeare, William. Hamlet. The Oxford Shakespeare. Ed. G. R. Hibbard. Oxford and New York: Oxford University Press, 1994.";"";"";"  Hohl Regula"
" I should be greeted, if not from Lord Hamlet.";"unedited";"_ Anon";"Mucedorus and Amadine";"Anon.  ""Mucedorus and Amadine."" A most pleasant comedy of Mucedorus the kings son of Valentia, and Amadine the kings daughter of Aragon with the merry conceits of Mouse : amplified with new additions, as it was acted before the Kings Majesty at Whitehall, on Shrove Sunday night by His Highness servants usually playing at the Globe. London: Francis Coles, 1650.  A3 verso; act 1 [spelling normalized].";"1591";"1591";"1591";"1591";"English";"[Enter Segasto running and Amadine after him, <span class=""quote"">being pursued with a bear.]<span>";"";"#008000 LONDON_Unknown venue";"@000884_A98_D98 Mucedorus and Amadine";"";"SuMe#005092 exit pursued by a bear";"Work unmarked";"Author unmarked";"Romance";"";"";"STAGE DIRECTION";"Local reference";"Secondary (Academic_Shakespeare)";"@010010
Bate, Jonathan et al., eds. William Shakespeare and others: Collaborative Plays. Basingstoke: Palgrave Macmillan, 2013. ";"[Enter Segasto runing and Amadine after him, being persued with a beare.]";"Anon.  ""Mucedorus and Amadine."" A most pleasant comedy of Mucedorus the kings son of Valentia, and Amadine the kings daughter of Aragon with the merry conceits of Mouse : amplified with new additions, as it was acted before the Kings Majesty at Whitehall, on Shrove Sunday night by His Highness servants usually playing at the Globe. London: Francis Coles, 1650.  A3 verso; act 1.";"  Hohl Regula"
" The graves stood tenantless and the sheeted dead";"provisional";"William Shakespeare";"Henry VI Part 2";"Shakespeare, William.  Henry VI Part 2.  Act 1, scene 4, lines 18-22.";"1591";"1591";"1591";"1591";"English";"[Bolingbroke:] [...] Deep night, dark night, the silent of the night,<br>
The time of night when Troy was set on fire,<br>
The time when screech owls cry and bandogs howl,<br>
<span class=""quote"">And spirits walk, and ghosts break up their graves - <br></span>
That time best fits the work we have in hand. ";"";"";"@000888_A91_D23 Henry VI Part 2";"";"SuId#030119 the living dead / WoKw_NatBir#004161 night screech owls ghosts";"Work unmarked";"Author unmarked";"Theatre";"";"Dialogue";"BODY OF TEXT";"Local reference";"Secondary (Academic_Shakespeare)";"/@010200-170.";"";"";"  Hohl Regula"
" For which, they say, you spirits oft walk in death,";"provisional";"Henry  Smith";"The Pilgrim's Wish";"Smith, Henry.  ""The Pilgrim's Wish."" Quoted in: Naseeb Shaheen. Biblical References in Shakespeare's Tragedies. Newark: University of Delaware Press, 1987.  7.";"1591";"1591";"1591";"1591";"English";"[...] walking spirits which have been so much talked of in time of popery, and were taken for the souls of them which were dead [...] whether <span class=""quote"">the souls of men departed <i>walk</i> after <i>death</i> and appear unto men, exhorting them unto this or that.</span>";"** Henry Smith was the most popular Puritan preacher of Elizabethan London.";"";"@005046 The Pilgrim's Wish";"";"SuId_AbsDea#030134 spirits walking";"Work unmarked";"Author unmarked";"Pamphlet or liturgical text";"Philosophy, religion";"";"BODY OF TEXT";"Local reference";"Secondary (Academic_Shakespeare)";"@010030
Shaheen, Naseeb. Biblical References in Shakespeare's Tragedies. Newark: University of Delaware Press, 1987. ";"";"";"  Hohl Regula"
" At supper.";"provisional";"William Shakespeare";"Henry VI Part 2";"Shakespeare, William.  Henry VI Part 2.  Act 5, scene 1, lines 117-118.";"1591";"1591";"1591";"1591";"English";"[Richard:] Fie! Charity, for shame! Speak not in spite,<br>
<span class=""quote"">For you shall sup with Jesu Christ tonight</span>";"";"";"@000888_A91_D23 Henry VI Part 2";"";"SuId#030291 sup with Jesus";"Work unmarked";"Author unmarked";"Theatre";"";"Dialogue";"BODY OF TEXT";"Local reference";"Secondary (Academic_Shakespeare)";"@010030
Shaheen, Naseeb. Biblical References in Shakespeare's Tragedies. Newark: University of Delaware Press, 1987. ";"";"";"  Hohl Regula"
" I should be greeted, if not from Lord Hamlet.";"provisional";"John Florio";"Florio's Second Fruits";"Florio, John.  Florios second frutes to be gathered of twelue trees, of diuers but delightsome tastes to the tongues of Italians and Englishmen. To which is annexed his Gardine of recreation yeelding six thousand Italian prouerbs. London: T. Orwin for Thomas Woodcock, 1591.  111 [normalized spelling]. ";"1591";"1591";"1591";"1591";"English";"[Giordano:] <span class=""quote"">Why do you stand bare-headed? You do yourself wrong.</span><br>
[Edward:] Pardon me, good sir, <span class=""quote"">I do it for my ease.</span><br>
[Giordano:] <span class=""quote"">I pray you be covered, you are too ceremonious.</span><br>
[Edward:] I am so well, that me thinks I am in heaven.<br>
[Giordano:] If you love me, put on your hat.<br>
[Edward:] <span class=""quote"">I will do it to obey you, not for any leisure that I take in.</span>";"";"";"@005067 Florio's Second Fruits";"";"SuMe#030611 bonnet on or off";"Work unmarked";"Author unmarked";"Anthology";"";"";"ANTHOLOGY ENTRY";"MQ_GENRE";"Secondary (Academic_Shakespeare)";"@010030/@010045/@010200/@005699-10.
Muir, Kenneth. The Sources of Shakespeare's Plays. London: Methuen, 1977.<br>
Shaheen, Naseeb. Biblical References in Shakespeare's Tragedies. Newark: University of Delaware Press, 1999. ";"[Giordano:] <span class=""quote"">Why do you stand barehedded? You do yourself wrong.</span><br>
[Edward:] Pardon me, good sir, <span class=""quote"">I doe it for my ease.</span><br>
[Giordano:] <span class=""quote"">I pray you be couered, you are too ceremonious.</span><br>
[Edward:] I am so well, that me thinks I am in heauen.<br>
[Giordano:] If you loue me, put on your hat.<br>
[Edward:] <span class=""quote"">I will doe it to obay you, not for any leasure that I take in.</span>";"Florio, John.  Florios second frutes to be gathered of twelue trees, of diuers but delightsome tastes to the tongues of Italians and Englishmen. To which is annexed his Gardine of recreation yeelding six thousand Italian prouerbs. London: T. Orwin for Thomas Woodcock, 1591.  111. ";"  Hohl Regula"
" I should be greeted, if not from Lord Hamlet.";"unedited";"_ Anon";"Mucedorus and Amadine";"Anon.  ""Mucedorus and Amadine."" A most pleasant comedy of Mucedorus the kings son of Valentia, and Amadine the kings daughter of Aragon with the merry conceits of Mouse : amplified with new additions, as it was acted before the Kings Majesty at Whitehall, on Shrove Sunday night by His Highness servants usually playing at the Globe. London: Francis Coles, 1650.  D3 verso [spelling normalized].";"1591";"1591";"1591";"1591";"English";"[Anselmo:] [...] Whether report gilded <span class=""quote"">a worthless Trunk </span><br>
Or <i>Amadine</i> deserved her high <span class=""quote"">extolment.</span>";"** This romance, first performed in 1598, has been controversially attributed to William Shakespeare, George Peele, Robert Greene and Thomas Lodge. ";"#008000 LONDON_Unknown venue";"@000884_A98_D98 Mucedorus and Amadine";"";"WoPh#031179 worthless trunk / WoMo#031180 extolment";"Work unmarked";"Author unmarked";"Romance";"";"Dialogue";"BODY OF TEXT";"Local reference";"Secondary (Academic_Shakespeare)";"@010010
Bate, Jonathan et al., eds.William Shakespeare and others: Collaborative Plays. Basingstoke: Palgrave Macmillan, 2013. ";"[Anselmo:] [...] Whether report gilded a worthlesse Trunke [...].";"Anon.  ""Mucedorus and Amadine."" A most pleasant comedy of Mucedorus the kings son of Valentia, and Amadine the kings daughter of Aragon with the merry conceits of Mouse : amplified with new additions, as it was acted before the Kings Majesty at Whitehall, on Shrove Sunday night by His Highness servants usually playing at the Globe. London: Francis Coles, 1650.  D3 verso.";"  Hohl Regula"
" They clepe us drunkards, and with swinish phrase";"provisional";"Thomas Nashe";"Pierce Pennyless' Supplication to the Devil";"Nashe, Thomas.  ""Pierce Pennilesse, his Supplication to the Divell."" The Works of Thomas Nashe. Ed. Ronald B. McKerrow. Rev. F. P. Wilson. 5 vols. Oxford: Basil Blackwell, 1958. 1:137-245.  205 [normalized spelling].";"1592";"1592";"1592";"1592";"English";"Then, if we had seen a man go wallowing in the streets, or line sleeping under the board, we would have spat at him as a toad, and <span class=""quote"">called him [a] foul drunken swine </span>[...].";"";"";"@005480 Pierce Pennyless' Supplication to the Devil";"";"WoKw#031115 drunk + swinish";"Work unmarked";"Author unmarked";"Prose unspecified";"";"First-person narrator";"BODY OF TEXT";"Local reference";"Secondary (Academic_Shakespeare)";"@010045/@010223/@010030
Muir, Kenneth.  The Sources of Shakespeare's Plays. London: Methuen, 1977. <br>
Davenport, A.  ""Shakespeare and Nashe's Pierce Pennilesse'."" Notes and Queries (September 1953): 371-374.<br>
Shaheen, Naseeb.  Biblical References in Shakespeare's Tragedies. Newark: University of Delaware Press, 1999. ";"Then, if we had seene a man goe wallowing in the streetes, or line sleeping vnder the boord, we would have spet at him as a toade, and <span class=""quote"">cald him foule drunken swine </span>[...].";"Nashe, Thomas.  ""Pierce Pennilesse, his Supplication to the Divell."" The Works of Thomas Nashe. Ed. Ronald B. McKerrow. Rev. F. P. Wilson. 5 vols. Oxford: Basil Blackwell, 1958. 1:137-245.  205.";"  Hohl Regula"
" I should be greeted, if not from Lord Hamlet.";"unedited";"George Peele / William Shakespeare";"Titus Andronicus";"Shakespeare, William and George Peele.  Titus Andronicus.  Act 2, scene 1, lines 92-93.";"1592";"1592";"1592";"1592";"English";"[Demetrius:] [...] Though Bassianus be the Emperor’s brother,<br>
Better than he have worn <span class=""quote"">Vulcan's badge.</span>";"";"";"@000928_A92_D94 Titus Andronicus";"";"NaMa#032272 Vulcan's badge / NaCa#004009 Vulcan or Hephaistos";"Work unmarked";"Author unmarked";"Tragedy";"";"Dialogue";"BODY OF TEXT";"Local reference";"Secondary (Academic_Shakespeare)";"@010000
Munro, John, Clement Mansfield Ingleby et al., eds. The Shakspere Allusion-Book: A Collection of Allusions to Shakspere from 1591 to 1700 [...]. London: Chatto and Windus; New York: Duffield and Co. 1909.";"";"";"  Hohl Regula"
" I should be greeted, if not from Lord Hamlet.";"unedited";"William Shakespeare";"The Taming of the Shrew";"Shakespeare, William.  <i>The Taming of the Shrew.  </i>Act 4, scene 2, line 7.";"1592";"1592";"1592";"1592";"English";"[Bianca:] What, master, read you? First <span class=""quote"">resolve me that.</span>";"";"";"@000916_A92_D23 The Taming of the Shrew";"";"WoPh#005180 resolve = solve a doubt";"Work unmarked";"Author unmarked";"Comedy";"";"Dialogue";"BODY OF TEXT";"";"Electronic search (Fulltext database_Literature)";"@010084
FDT ";"";"";"  Hohl Regula"
" See, it stalks away!";"provisional";"Thomas Nashe";"Pierce Pennyless' Supplication to the Devil";"Nashe, Thomas.  ""Pierce Pennilesse, his Supplication to the Divell."" The Works of Thomas Nashe. Ed. Ronald B. McKerrow. Rev. F. P. Wilson. 5 vols. Oxford: Basil Blackwell, 1958. 1:137-245.  178 [normalized spelling].";"1592";"1592";"1592";"1592";"English";"<span class=""quote"">Thus walks he up and down in his Majesty, </span>taking a yard of ground at every step, and stamps on he earth so terribly, as if he meant to knock up spirits, when (foul drunken bezzle) if an Englishman set his little finger to him, he falls like a hogs-trough that is set on one end.";"";"";"@005480 Pierce Pennyless' Supplication to the Devil";"";"SuId#005080 majestic stalking ghost";"Work unmarked";"Author unmarked";"Prose unspecified";"";"Narrator";"BODY OF TEXT";"Local reference";"Secondary (Academic_Shakespeare)";"@010154
Davenport, A.  ""Shakespeare and Nashe's Pierce Pennilesse."" Notes and Queries 198 (September 1953): 371-374.";"<span class=""quote"">Thus walkes he vp and downe in his Maiestie, </span>taking a yard of ground at euery step, amd stamps on he earth so terrible, as if he ment to knocke vppe spirite, when (foule drunken bezzle) if an Englishman set his little fnger to him, he falles like a hogs-trough that is set on one end.";"Nashe, Thomas.  ""Pierce Pennilesse, his Supplication to the Divell."" The Works of Thomas Nashe. Ed. Ronald B. McKerrow. Rev. F. P. Wilson. 5 vols. Oxford: Basil Blackwell, 1958. 1:137-245.  178.";"  Hohl Regula"
" I should be greeted, if not from Lord Hamlet.";"unedited";"William Shakespeare";"The Taming of the Shrew";"Shakespeare, William.  The Taming of the Shrew.  Act 4, scene 1, lines 53-54.";"1592";"1592";"1592";"1592";"English";"[Grumio:] Out of their saddles into the dirt, <span class=""quote"">and thereby hangs a tale.";"";"";"@000916_A92_D23 The Taming of the Shrew";"Ben Jonson";"WoPh#035082 thereby hangs a tale";"Work unmarked";"Author unmarked";"Comedy";"";"Dialogue";"BODY OF TEXT";"Local reference";"Electronic search (Fulltext database_Literature)";"@010001";"";"";"Reitzer Elliot"
" When I to sulphurous and tormenting flames";"provisional";"Thomas Nashe";"Pierce Pennyless' Supplication to the Devil";"Nashe, Thomas.  ""Pierce Pennilesse, his Supplication to the Divell."" The Works of Thomas Nashe. Ed. Ronald B. McKerrow. Rev. F. P. Wilson. 5 vols. Oxford: Basil Blackwell, 1958. 1:137-245.  206 [normalized spelling].";"1592";"1592";"1592";"1592";"English";"Clim of the Clough [the devil] thou that usest to drink nothing but scalding lead and <span class=""quote"">sulphur</span> in hell, thou art not so greedy of thy night gear. O, but thou hast a foul swallow, if it come once <span class=""quote"">to carousing of human blood; </span>but that's but seldom [...] otherwise thou art tide at rack and manger, and drinkest nothing but the <i>Aqua vitae</i> of <span class=""quote"">vengeance </span>all thy life time [...].";"";"";"@005480 Pierce Pennyless' Supplication to the Devil";"";"SuMe#030032 Revenge / SuMe#031004 master-servant misunderstanding / WoKw#005081 carouse + sulphur";"Work unmarked";"Author unmarked";"Prose unspecified";"";"Narrator";"BODY OF TEXT";"Local reference";"Secondary (Academic_Shakespeare)";"@010223-372.
Davenport, Arnold.  ""Shakespeare and Nashe's Pierce Pennilesse."" Notes and Queries 198 (September 1953): 371-374.  372.";"Clim of the Clough [the devil] thou that vsest to drinke nothing but scalding lead and sulpher in hell, thou art not so greedie of thy night geare. O, but thou hast a foule swallow, if it come once <span class=""quote"">to carousing of humane bloud; </span>but thats but seldom [...] otherwise thou art tide at rack and manger, and drinkest nothing but the <i>Aqua vitae</i> of <span class=""quote"">vengeance </span>all thy life time [...].";"Nashe, Thomas.  ""Pierce Pennilesse, his Supplication to the Divell."" The Works of Thomas Nashe. Ed. Ronald B. McKerrow. Rev. F. P. Wilson. 5 vols. Oxford: Basil Blackwell, 1958. 1:137-245.  206.";"  Hohl Regula"
" But I am pigeon-liver'd and lack gall";"provisional";"Thomas Nashe";"Pierce Pennyless' Supplication to the Devil";"Nashe, Thomas.  ""Pierce Pennilesse, his Supplication to the Divell."" The Works of Thomas Nashe. Ed. Ronald B. McKerrow. Rev. F. P. Wilson. 5 vols. Oxford: Basil Blackwell, 1958. 1:137-245.  210 [normalized spelling].";"1592";"1592";"1592";"1592";"English";"[...] <span class=""quote"">the heavy headed gluttonous house-dove </span>[...].";"";"";"@005480 Pierce Pennyless' Supplication to the Devil";"";"WoKw_NatBir#005078 pigeons have no gall";"Work unmarked";"Author unmarked";"Prose unspecified";"";"Narrator";"BODY OF TEXT";"Local reference";"Secondary (Academic_Shakespeare)";"@010223
Davenport, A.  ""Shakespeare and Nashe's Pierce Pennilesse'."" Notes and Queries (September 1953): 371-374.";"[...] <span class=""quote"">the heauie headed gluttonous house-doue </span>[...].";"Nashe, Thomas.  ""Pierce Pennilesse, his Supplication to the Divell."" The Works of Thomas Nashe. Ed. Ronald B. McKerrow. Rev. F. P. Wilson. 5 vols. Oxford: Basil Blackwell, 1958. 1:137-245.  210.";"  Hohl Regula"
" A dull and muddy-mettled rascal, peak,";"provisional";"Thomas Nashe";"Pierce Pennyless' Supplication to the Devil";"Nashe, Thomas.  ""Pierce Pennilesse, his Supplication to the Divell."" The Works of Thomas Nashe. Ed. Ronald B. McKerrow. Rev. F. P. Wilson. 5 vols. Oxford: Basil Blackwell, 1958. 1:137-245.  210 [normalized spelling].";"1592";"1592";"1592";"1592";"English";"<span class=""quote"">Sloth and sluggish security </span>[...]. <br> <br>
[...]<span class=""quote""> neglect </span>[...] <span class=""quote"">dallying </span>[...] <span class=""quote"">indignities </span>[...] <span class=""quote"">love-dream </span>[...].";"";"";"@005480 Pierce Pennyless' Supplication to the Devil";"";"SuMe#032159 sluggish, muddy laziness";"Work unmarked";"Author unmarked";"Prose unspecified";"";"Narrator";"BODY OF TEXT";"Local reference";"Secondary (Academic_Shakespeare)";"@010154

Davenport, Arnold.  ""Shakespeare and Nashe's Pierce Pennilesse'."" Notes and Queries (September 1953): 371-374.";"<span class=""quote"">Sloth and sluggish securitye </span>[...].";"Nashe, Thomas.  ""Pierce Pennilesse, his Supplication to the Divell."" The Works of Thomas Nashe. Ed. Ronald B. McKerrow. Rev. F. P. Wilson. 5 vols. Oxford: Basil Blackwell, 1958. 1:137-245.  210.";"  Hohl Regula"
