"Location";"Status";"Authors";"Title";"Bibliographical reference";"Composition (year_from)";"Composition (year_to)";"First publication (year_from)";"First publication (year_to)";"Language";"Text";"Comment";"General reference";"Line reference";"Overlap/Similarity";"Modifications";"Marking for work";"Marking for author";"Genre";"Subject";"Narrative voice";"Textual functions";"Intertextual relations";"Source";"Bib. ref. source";"URL";"Internal comment";"Contributor"
" I should be greeted, if not from Lord Hamlet.";"unedited";"William Shakespeare";"Coriolanus";"Shakespeare, William.  Coriolanus.  Act 1, scene 9, lines 48-49.";"1608";"1608";"1608";"1608";"English";"[Martius:] <span class=""quote"">When drums and trumpets shall
I' th' field prove flatterers</span> […].";"";"";"@001589_A08_D23 Coriolanus";"";"WoPh#032154 drums and trumpets are flatterers";"Work unmarked";"Author unmarked";"Theatre";"";"Dialogue";"BODY OF TEXT";"Local reference";"Secondary (Academic_Shakespeare)";"@010083-61.
Adams, Joseph Quincy, Jr.  ""William Heminge and Shakespeare."" Modern Philology 12:1 (May, 1914): 51-64.  61.";"";"";"Heeg Stefanie"
" By indirections find directions out:";"provisional";"Thomas Pickering";"The Whole Treatise of the Cases of Conscience";"Pickering, Thomas,  ed. William Perkins. The Whole Treatise of the Cases of Conscience. Distinguished into Three Books. Taught and delivered by M. W. Perkins in his holiday Lectures, examined by his owne briefs, and published for the common good, by Thomas Pickering. London: John Legatt, 1617.  Unpaginated section ""Epistle Dedicatorie to the Right Honorable, Edward, Lord Dennie Baron of Waltham, &c.""";"1608";"1608";"1608";"1608";"English";"By these instances, and many more that might be alleged to this purpose, it is apparant, upon how weake and unstable grounds the <i>Case-divinity</i> of the Popish Church standeth, and how <span class=""quote"">indirect a course they take</span>, for the resolution and <span class=""quote"">direction of the troubled Conscience</span>.";"";"";"@005177 The Whole Treatise of the Cases of Conscience";"";"WoKw##030209 directions + indirections";"Work unmarked";"Author unmarked";"Pamphlet or liturgical text";"Philosophy, religion";"";"BODY OF TEXT";"Local reference";"Electronic search (Fulltext database_Literature)";"@010107-Last accessed 19 June 2009.";"";"";"Quassdorf Sixta"
" I should be greeted, if not from Lord Hamlet.";"unedited";"Lording Barry";"Ram Alley";"Barry, Lording.  Ram-Alley. Or Merrie-Trickes. A Comedy Divers times here-to-fore acted. By the Children of the Kings Reuels. Written by Lo: Barrey. London: G. Eld for Robert Wilson, 1611.  I1 verso; act 5, scene 1, line 380.";"1608";"1608";"1608";"1608";"English";"[Sir Oliver:] God morrow <span class=""quote"">Bride, fresh, fresh, as the month of May</span> [...].";"";"";"@001572_A08_D11 Ram Alley";"";"WoPh#032212 fresh bride like May";"Work unmarked";"Author unmarked";"Theatre";"";"Dialogue";"BODY OF TEXT";"";"Secondary (Annotated edition_Literature)";"@005700-78.";"[Sir Oliver:] God morrow <span class=""quote"">Bride, fresh, fresh, as the month of May</span> [...].";"Barry, Lording.  Ram-Alley. Or Merrie-Trickes. A Comedy Divers times here-to-fore acted. By the Children of the Kings Reuels. Written by Lo: Barrey. London: G. Eld for Robert Wilson, 1611.  I1 verso; act 5, scene 1, line 380.";"Heeg Stefanie"
" I should be greeted, if not from Lord Hamlet.";"unedited";"Lording Barry";"Ram Alley";"Barry, Lording.  Ram-Alley. Or Merrie-Trickes. A Comedy Divers times here-to-fore acted. By the Children of the Kings Reuels. Written by Lo: Barrey. London: G. Eld for Robert Wilson, 1611.  D1 verso; act 2, scene 1, lines 404-406 [normalized spelling].";"1608";"1608";"1608";"1608";"English";"[Adriana:] A pretty knave, in faith come home to night, <br>
Shalt have a posset and <span class=""quote"">candied Eringoes</span>, <br>
A bed if need be to, I love a life, ";"";"";"@001572_A08_D11 Ram Alley";"";"WoMo#032197 eringo";"Work unmarked";"Author unmarked";"Theatre";"";"Dialogue";"BODY OF TEXT";"";"Secondary (Annotated edition_Literature)";"@005700-90./@010015-106.";"[Adriana:] A pretty knaue, ifaith come home to night, <br>
Shalt haue a posset and <span class=""quote"">candi'd Eringoes, </span><br>
A bed if need be to, I loue a life [...].<br>";"Barry, Lording.  Ram-Alley: Or Merrie-Trickes. A Comedy Divers times here-to-fore acted. By the Children of the Kings Reuels. Written by Lo: Barrey. London: G. Eld for Robert Wilson, 1611.  D1 verso; act 2, scene 1, lines 404-406.";"Heeg Stefanie"
" I should be greeted, if not from Lord Hamlet.";"unedited";"Lording Barry";"Ram Alley";"Barry, Lording.  Ram-Alley. Or Merrie-Trickes. A comedy Diuers times here-to-fore acted. By the Children of the Kings Reuels. Written by Lo: Barrey. London: G. Eld for Robert Wilson, 1611.  A3 verso; act 1, lines 73-82 [spelling normalized].";"1608";"1608";"1608";"1608";"English";"[Frances:] You know sir,  <br>
I did enjoy a quiet country life, <br>
Spotless and free, till you corrupted me, <br> 
And brought me to the Court, I never knew, <br>
What sleeking, glazing, or what pressing meant, <br>
Till you preferred me to your Aunt the Lady, <br>
<span class=""quote"">I knew no Ivory teeth, no caps of hair, <br>
No <i>Mercury</i> water,</span> <i>fucas</i>, or perfumes, <br>
To helpe a Lady's breath, untill your Aunt, <br> 
Learnt me the common trick. ";"** This comedy was first performed by the Children of the King's Reves at the Whitefriars  in 1608.";"#009007 Children of the King's Revels  / #008006 LONDON_Whitefriars";"@001572_A08_D11 Ram Alley";"";"WoPu#230179 mercury lotion pun";"Work unmarked";"Author unmarked";"Comedy";"";"Dialogue";"BODY OF TEXT";"Local reference";"Secondary (Annotated edition_Literature)";"@010081-79.
Adams, Joseph Quincy, Jr.  John Mason's The Turke edited from the Quartos of 1610 and 1632. Louvain: A. Uytpruyst, 1913.  79.";"[Frances:] You know sir,  <br>
I did inioy a quiet country life, <br>
Spotlesse and free, till you corrupted mee, <br> 
And brought me to the Court, I neuer knew, <br>
What sleeking, glazing, or what pressing meant, <br>
Till you preferd me to your Aunt the Lady, <br>
<span class=""quote"">I knew no Iuorie teeth, no caps of heire, <br>
No Mercury water,</span> fucas, or perfumes, <br>
To helpe a Ladies breath, vntill your Aunt, <br> 
Learnt me the common trick. ";"Barry, Lording.  Ram-Alley: Or Merrie-Trickes. A Comedy Divers times here-to-fore acted. By the Children of the Kings Reuels. Written by Lo: Barrey. London: G. Eld for Robert Wilson, 1611.  A3 verso; act 1, lines 73-82.";"Reitzer Elliot"
" I should be greeted, if not from Lord Hamlet.";"unedited";"Lording Barry";"Ram Alley";"Barry, Lording.  Ram-Alley. Or Merrie-Trickes. A Comedy Divers times here-to-fore acted. By the Children of the Kings Reuels. Written by Lo: Barrey. London: G. Eld for Robert Wilson, 1611.  H4 recto; act 5, scene 1, lines 199-203 [normalized spelling].";"1608";"1608";"1608";"1608";"English";"[William Small-shanks:] [...] the widow and myself, <br>
Will <span class=""quote"">scamble out the shaking of the sheets</span>, <br>
Without your music, we have no need of fiddlers, <br>
To our dancing, foot have you no manners, <br>
Cannot a man take his natural rest.";"";"";"@001572_A08_D11 Ram Alley";"";"WoKw_CulMus#032216 dance the shaking of the sheets";"Work unmarked";"Author unmarked";"Theatre";"";"Dialogue";"BODY OF TEXT";"";"Electronic search (Fulltext database_Literature)";"@010001 ";"[William Small-shanks:] [...] the widdow and my selfe, <br>
Will scamble out the shaking of the sheets, <br>
Without your musicke, we haue no need of fidlers, <br>
To our dauncing, foote haue you no manners, <br>
Cannot a man take his naturall rest.";"Barry, Lording.  Ram-Alley: Or Merrie-Trickes. A Comedy Divers times here-to-fore acted. By the Children of the Kings Reuels. Written by Lo: Barrey. London: G. Eld for Robert Wilson, 1611.  H4 recto; act 1, scene 1, lines 199-203.";"Heeg Stefanie"
" For this relief much thanks: 'tis bitter cold,";"provisional";"Francis Beaumont / John Fletcher";"The Coxcomb";"Beaumont, Francis and John Fletcher.  ""The Coxcomb."" The Dramatic Works in the Beaumont and Fletcher Canon. Ed. Fredson Bowers. 10 vols. Cambridge: Cambridge University Press, 1976. Vol 1, 261-366.  291; act 2, scene 2, lines 1-8 [normalized spelling].";"1609";"1609";"1609";"1609";"English";"[A Tinker (with a cord):] <span class=""quote"">'Tis bitter cold; </span>a plague upon these Rogues, how wary they are grown? not a door open now, but double-barred, not a window, but up with a case of wood like a spice box, and their locks unpickable, the very smiths that were half venturers, drink penitent single Ale, this is the Iron age, the Ballad sings of [...].";"** This comedy was first performed by the Children of the Whitefriars in London in 1609.";"#009004 Children of the Whitefriars / #008000 LONDON_Unknown venue";"@001598_A09_D47 The Coxcomb";"Robert Benfield";"WoPh#030100 'tis bitter cold";"Work unmarked";"Author unmarked";"Comedy";"";"Dialogue";"BODY OF TEXT";"Local reference";"Electronic search (Fulltext database_Literature)";"@010001-Last accessed 27 December 2018.";"[A Tinker (with a cord):] <span class=""quote"">'Tis bitter cold; </span>a plague upon these Rogues, how wary they are growne? not a doore open now, but double bard, not a window, but up with a case of wood like a spice box, and their locks unpickable, the very smithes that were halfe venturers, drink penitent single Ale, this is the Iron age, the Ballad sings of [...]. ";"Beaumont, Francis and John Fletcher.  ""The Coxcomb."" The Dramatic Works in the Beaumont and Fletcher Canon. Ed. Fredson Bowers. 10 vols. Cambridge: Cambridge University Press, 1976. Vol 1, 261-366.  291; act 2, scene 2, lines 1-8.";"Tranter Maria"
" I should be greeted, if not from Lord Hamlet.";"unedited";"Francis Beaumont / John Fletcher";"The Coxcomb";"Beaumont, Francis and John Fletcher.  ""The Coxcomb."" The Dramatic Works in the Beaumont and Fletcher Canon. Ed. Fredson Bowers. 10 vols. Cambridge: Cambridge University Press, 1976. Vol 1, 261-366.  340; act 5, scene 3, line 78 [normalized spelling].";"1609";"1609";"1609";"1609";"English";"[Justice:] <span class=""quote"">There hangs a tale.</span>";"";"#009004 Children of the Whitefriars / #008006 LONDON_Whitefriars";"@001598_A09_D47 The Coxcomb";"William Barksted / Joseph Taylor";"WoPh#035082 thereby hangs a tale";"Work unmarked";"Author unmarked";"Comedy";"";"Dialogue";"BODY OF TEXT";"Local reference";"Electronic search (Fulltext database_Literature)";"@010001";"[Justice:] <span class=""quote"">There hangs a tale.</span>";"Beaumont, Francis and John Fletcher.  ""The Coxcomb."" The Dramatic Works in the Beaumont and Fletcher Canon. Ed. Fredson Bowers. 10 vols. Cambridge: Cambridge University Press, 1976. Vol 1, 261-366.  340; act 5, scene 3, line 78.";"Reitzer Elliot"
" I should be greeted, if not from Lord Hamlet.";"unedited";"Nathan Field";"Amends For Ladies";"Field, Nathan.  ""Amends for Ladies."" <i>The Plays of Nathan Field: Edited from the Original Quartos with Introduction and Notes. </i>Ed. William Peery. Austin: The University of Texas Press, 1950. 159-236.  172; act 1, scene 1, lines 373-374 [normalized spelling].";"1610";"1610";"1610";"1610";"English";"[Widow:] Nay prithee tell the cause, come <span class=""quote"">here's none but friends.</span>";"";"";"@001615_A10_D18 Amends for Ladies";"Nathan Field";"WoPh#530034 here is none but friends";"Work unmarked";"Author unmarked";"Comedy";"";"Dialogue";"BODY OF TEXT";"Local reference";"Secondary (Annotated edition_Literature)";"@010049-273.
Peery, William, ed.  The Plays of Nathan Field: Edited from the Original Quartos with Introduction and Notes. Austin: The University of Texas Press, 1950.  273.";"[Widow:] Nay prithie tell the cause, come heer's none but friends.";"Field, Nathan.  ""Amends for Ladies."" The Plays of Nathan Field: Edited from the Original Quartos with Introduction and Notes. Ed. William Peery. Austin: The University of Texas Press, 1950. 159-236.  172; act 1, scene 1, lines 373-374.";"  Hohl Regula"
" I should be greeted, if not from Lord Hamlet.";"unedited";"William Barksted / Lewis Mackin / John Marston";"The Insatiate Countess";"Marston, John, William Barksted and Lewis Mackin.  ""The Insatiate Countesse."" The Plays of John Marston in Three Volumes. Ed. H. Harvey Wood. Edinburgh and London: Oliver and Boyd, 1934-1939. 3:1-82.  25; act 2, scene 1.";"1610";"1610";"1610";"1610";"English";"[Isabella:] He's gone, that <span class=""quote"">lightning that a while doth strike<br>
Our eyes with amazed brightness, and on a sudden<br>
Leaves us in prisoned darkness.</span>";"";"";"@001605_A10_D13 The Insatiate Countess";"";"WoKw#004128 darkness fast as lightning";"Work unmarked";"Author unmarked";"Theatre";"";"Dialogue";"BODY OF TEXT";"";"Secondary (Academic_Shakespeare)";"@006000-71.";"[Isabella:] He's gone, that <span class=""quote"">lightning that a while doth strike<br>
Our eyes with amaz'd brightnesse, and on a sudden<br>
Leaves us in prison'd darknesse.</span>";"";"  Hohl Regula"
" I should be greeted, if not from Lord Hamlet.";"unedited";"Nathan Field";"Amends for Ladies";"Field, Nathan.  ""Amends for Ladies."" The Plays of Nathan Field: Edited from the Original Quartos with Introduction and Notes. Ed. William Peery. Austin: The University of Texas Press, 1950. 159-236.  191-192; act 3, scene 1, lines 2-6 [normalized spelling].";"1610";"1610";"1610";"1610";"English";"[Subtle:] She's a rare wife believe it, Sir, were all such,<br>
We never should have false inheritors.<br>
[Husband:] Pish friend, <span class=""quote"">there is not woman in the world<br>
Can hold out in the end, </span>if youth, shape, wit,<br>
Met in one subject, do assault her aptly [...].";"";"";"@001615_A10_D18 Amends for Ladies";"";"SuMe_GenWom#030255 no woman holds out in the end";"Work unmarked";"Author unmarked";"Comedy";"";"Dialogue";"BODY OF TEXT";"Local reference";"Secondary (Annotated edition_Literature)";"@010049-279.";"[Subtle:] Shee's a rare wife beleeue it, Sir, were all such,<br>
We neuer should have false inheritors.<br>
[Husband:] Pish friend, there is not woman in the world<br>
Can hold out in the end, if youth, shape, wit,<br>
Met in one subject, doe assault her aptlie [...].";"Field, Nathan.  ""Amends for Ladies."" The Plays of Nathan Field: Edited from the Original Quartos with Introduction and Notes. Ed. William Peery. Austin: The University of Texas Press, 1950. 159-236.  191-192; act 3, scene 1, lines 2-6.";"  Hohl Regula"
" I should be greeted, if not from Lord Hamlet.";"unedited";"Nathan Field";"Amends for Ladies";"Field, Nathan.  ""Amends for Ladies."" The Plays of Nathan Field: Edited from the Original Quartos with Introduction and Notes. Ed. William Peery. Austin: The University of Texas Press, 1950. 159-236.  191-192; act 3, scene 1, lines 11-17 [normalized spelling].";"1610";"1610";"1610";"1610";"English";"[Husband:] [...] <span class=""quote"">you must woo discretely; first observe<br>
The disposition of her you attempt,<br>
If she be sprightly and heroical,<br>
Possess her that you are valiant, and have spirit,<br>
Talk nothing but of beating every man<br>
That is your hindrance, though you do not do it,<br>
Or dare not, 'tis no matter.</span>";"";"";"@001615_A10_D18 Amends for Ladies";"";"SuMe#030258 seduction advice";"Work unmarked";"Author unmarked";"Theatre";"";"Dialogue";"BODY OF TEXT";"Local reference";"Secondary (Annotated edition_Literature)";"@010049-279.
Peery, William, ed.  The Plays of Nathan Field: Edited from the Original Quartos with Introduction and Notes. Austin: The University of Texas Press, 1950.  279.";"[Husband:] [...] you must wooe discreetely; first obserue<br>
The disposition of her you attempt,<br>
If she be sprightly and heroicall,<br>
Possesse her that you are valiant, and haue spirit,<br>
Talke nothing but of beating euery man<br>
That is your hinderance, though you doe not doe it,<br>
Or dare not, t'is no matter.";"Field, Nathan.  ""Amends for Ladies."" The Plays of Nathan Field: Edited from the Original Quartos with Introduction and Notes. Ed. William Peery. Austin: The University of Texas Press, 1950. 159-236.  191-192; act 3, scene 1, lines 11-17.";"  Hohl Regula"
" I should be greeted, if not from Lord Hamlet.";"unedited";"Ben Jonson";"Epicoene, or The Silent Woman";"Jonson, Ben.  ""Epicene."" The Cambridge Edition of the Works of Ben Jonson. Gen. eds. David Bevington, Martin Butler and Ian Donaldson. Cambridge: Cambridge University Press, 2012. Vol. 3, 385-505.  454; act 4, scene 1, lines 68-94.";"1610";"1610";"1610";"1610";"English";"[Truewit:] [...] If you appear learned to an ignorant wench, or jocund to a sad, or witty to a foolish, why, she presently begins to mistrust herself. <span class=""quote"">You must approach them i'their own height, their own line, for the contrary makes many that fear to commit themselves to noble and worthy fellows run into the embraces of a rascal. If she love wit, give verses, though you borrow 'em of a friend or buy 'em to have good. If valour, talk of your sword, and be frequent in the mention of quarrels though you be staunch in fighting. If activity, be seen o' your barbary often, or leaping over stools for the credit of your back. If she love good clothes or dressing, have your learned counsel about you every morning, your French taylor, barber, linener, etc. Let your powder, your glass, and your comb be your dearest acquaintance.</span> Take more care for the ornament of your head than the safety, and wish the commonwealth rather troubled than a hair about you. That will take her. Then, if she be covetous and craving, do you promise anything and perform sparingly; so shall you keep her in appetite still. Seem as you would give, but be like a barren field that yields little, or unlucky dice to foolish and hoping gamesters. Let your gifts be slight and dainty rather then precious. Let cunning be above cost. Give cherries at time of year, or apricots; and say they were sent you out o' the country, though you bought 'em in Cheapside. Admire her tires; like her in all fashions; compare her in every habit to some deity; invent excellent dreams to flatter her, and riddles. Or, if she be a great one, perform always the second parts to her: like what she likes, praise whom she praises, and fail not to make the household and servants yours, yea the whole family, and salute 'em by their names: - 'tis but light cost if you can purchase 'em so - and make her physician your pensioner, and her chief woman. Nor will it be out of your gain to make love to her too, so she follow, not usher, her lady's pleasure. All blabbing is taken away when she comes to be a part of the crime.";"** This comedy was first performed in 1610 by the Children of the Queen's Revels at Whitefriars.";"#009010 Children of the Queen's Revels / #008006 LONDON_Whitefriars";"@001603_A10_D16 Epicoene, or The Silent Woman";"Nathan Field / William Barksted / Joseph Taylor";"SuMe#030258 seduction advice";"Work unmarked";"Author unmarked";"Comedy";"";"Dialogue";"BODY OF TEXT";"Local reference";"Secondary (Annotated edition_Literature)";"@010049-279.
Peery, William. The Plays of Nathan Field: Edited from the Original Quartos with Introduction and Notes. Austin: The University of Texas Press, 1950.  279.";"[Truewit:] [...] If you appeare learned to an ignorant wench, or iocund to a sad, or witty to a foolish, why shee presently begins to mistrust her selfe. You must approch them i'their owne height, their owne line: for the contrary makes many that feare to commit themselues to noble and worthy fellowes, run into the imbraces of a rascall. If shee loue wit, giue verses, though you borrow 'hem of a friend, or buy 'hem, to haue good. If valour, talke of your sword, and be frequent in the mention of quarrels, though you be staunch in fighting If actiuitie, be seene o'your barbary often, or leaping ouer stooles, for the credit of your back. If shee loue good clothes or dressing, haue your learned counsell about you euery morning, your french taylor, barber, linnener, &c. Let your poulder, your glasse, and your combe, be your dearest acquaintance. Take more care for the ornament of your head, then the safetie: and wish the common-wealth rather troubled, then a haire about you. That will take her. Then if shee be couetous and crauing, doe you promise any thing, and performe sparingly: so shall you keepe her in appetite still. Seeme as you would giue, but be like a barren field that yeelds little, or vnlucky dice, to foolish, and hoping gamesters. Let your gifts be slight, and daintie, rather then pretious. Let cunning be aboue cost. Giue cherries at time of yeere, or apricots; and say they were sent you out o' the countrey, though you bought 'hem in Cheap-side . Admire her tyres; like her in all fashions; compare her in euery habit to some deitie; inuent excellent dreames to flatter her, and riddles, or, if shee bee a great one, performe alwaies the second parts to her: like what shee likes, praise [100]  whom she praises, and faile not to make the houshold and seruants yours, yea the whole family, and salute 'hem by their names: ('tis but light cost if you can purchase 'hem so) and make her physitian your pensioner, and her chiefe woman. Nor will it bee out of your gaine to make loue to her too, so shee follow, not vsher, her ladies pleasure. All blabbing is taken away, when shee comes to be a part of the crime.";"Jonson, Ben.  ""Epicoene."" The Workes of Beniamin Jonson. London: Will Stansby, 1616. 526-599.  566-567; act 4, scene 1.";"Reitzer Elliot"
" And by opposing end them? To die: to sleep;";"ok";"Francis Beaumont / John Fletcher";"The Scornful Lady";"Beaumont, Francis and John Fletcher.  ""The Scornful Ladie."" The Dramatic Works in the Beaumont and Fletcher Canon. Ed. Fredson Bowers. 10 vols. Cambridge: Cambridge University Press, 1970.  2:449-565. 479; act 2, scene 1, lines 39-44 [normalized spelling].";"1610";"1610";"1610";"1610";"English";"[Roger:] Have patience Sir, untill our fellow Nicholas be deceased, that is, asleep: for so the word is taken; <span class=""quote"">to sleep to die, to die to sleep</span>: a very Figure Sir.<br>
[Welford:] Cannot you cast another for the Gentlewoman?<br>
[Roger:] Not till the man be in his bed, his grave; his grave his bed; the very same again Sir.";"";"";"@001626_A10_D16 The Scornful Lady";"";"SuId_AbsDea#030069 death as sleep";"Work unmarked";"Author unmarked";"Comedy";"";"Dialogue";"BODY OF TEXT";"MQ_VERBAL_Noun";"Secondary (Academic_Shakespeare)";"@010005/@010000-1:292.
Greenfield, Sayre. ""Quoting Hamlet in the Early Seventeenth Century."" Modern Philology 105.3 (2008): 510–534. <br>
Munro, John, Clement Mansfield Ingleby et al., eds. The Shakspere Allusion Book: A Collection of Allusions to Shakspere from 1591 to 1700 [...]. London: Chatto and Windus; New York: Duffield and Co., 1909. 1, 292.";"[Roger:] Have patience Sir, untill our fellowe Nicholas bee deceast, that is, a sleepe: for so the word is taken; <span class=""quote"">to sleepe to die, to die to sleepe</span>: a very Figure Sir.<br>
[Welford:] Cannot you cast another for the Gentleweomen? (sic)<br>
[Roger:] Not till the man bee in his bed, his grave; his grave his bed; the very same againe Sir.";"Beaumont, Francis and John Fletcher.  ""The Scornful Ladie."" The Dramatic Works in the Beaumont and Fletcher Canon. Ed. Fredson Bowers. 10 vols. Cambridge: Cambridge University Press, 1970.  2:449-565.  479; act 2, scene 1, lines 39-44.";"Kristmann Stefan"
" I should be greeted, if not from Lord Hamlet.";"unedited";"Nathan Field";"Amends for Ladies";"Field, Nathan.  ""Amends for Ladies."" The Plays of Nathan Field: Edited from the Original Quartos with Introduction and Notes. Ed. William Peery. Austin: The University of Texas Press, 1950. 159-236.  202-202; act 3, scene 4, lines 24-29 [normalized spelling].";"1610";"1610";"1610";"1610";"English";"[Drawer:] [...] I have been at <i>Bess Turnup's</i> and she swears all the Gentlewomen went to see a Play <span class=""quote"">at the Fortune, </span>and are not come in yet, and she believes they sup with Players.<br>
[Tear-Chops:] Damn me, we must kill all those rogues, we shall never <span class=""quote"">keep a whore honest </span>for them.";"";"";"@001615_A10_D18 Amends for Ladies";"";"NaVn_CulThe#008023 LONDON_The Fortune Playhouse / NaBo@001459 The Honest Whore Part 2 / NaBo@001431 The Honest Whore Part 1";"Work character by epithet";"Author unmarked";"Theatre";"";"Dialogue";"BODY OF TEXT";"";"Secondary (Annotated edition_Literature)";"@010049-283. 
";"[Drawer:] [...] I haue beene at <i>Besse Turnups</i> and she sweares all the Gentlewomen went to see a Play at the Fortune, and are not come in yet, and she beleeues they sup with Players.<br>
[Teare-Chops:] Dam-me, we must kill all those rogues, we shall neuer keepe a whore honest for them.";"Field, Nathan.  ""Amends for Ladies."" The Plays of Nathan Field: Edited from the Original Quartos with Introduction and Notes. Ed. William Peery. Austin: The University of Texas Press, 1950. 159-236.  202-203; act 3, scene 4, lines 24-29.";"  Hohl Regula"
