"Location";"Status";"Authors";"Title";"Bibliographical reference";"Composition (year_from)";"Composition (year_to)";"First publication (year_from)";"First publication (year_to)";"Language";"Text";"Comment";"General reference";"Line reference";"Overlap/Similarity";"Modifications";"Marking for work";"Marking for author";"Genre";"Subject";"Narrative voice";"Textual functions";"Intertextual relations";"Source";"Bib. ref. source";"URL";"Internal comment";"Contributor"
" Alas, he's mad!";"ok";"John Marston";"Antonio's Revenge";"Marston, John.  ""Antonios Revenge."" The Plays of John Marston in Three Volumes. Ed. H. Harvey Wood. Edinburgh and London: Oliver and Boyd, 1934-1939. 1:65-134.  95 [normalized spelling].";"1600";"1600";"1600";"1600";"English";"[Maria:]<span class=""quote""> What, my good boy, stark mad?</span> <br>
[Antonio:] I am not. <br>
[Maria:] <span class=""quote"">Alas, </span>is that strange news? [...]<br>
[Maria:] <span class=""quote"">Alas my son's distraught. Sweet boy appease<br>
Thy mutining affections.<br></span>
[Antonio:] By the astoning terror of swart night,<br>
By the infectious damps of clammy graves,<br>
And by the mould that presseth down<br>
My dead father's skull: I'll be revenged. ";"";"";"@001271_A00_D02 Antonio's Revenge";"";"SuMe#032182 son mad";"Work unmarked";"Author unmarked";"Tragedy";"";"Dialogue";"BODY OF TEXT";"Local reference";"Secondary (Annotated edition_Literature)";"@010047-133./@006323-Last accessed 10 March 2020.";"[Maria:]<span class=""quote""> What, my good boy, stark mad?</span> <br>
[Antonio:] I am not. <br>
[Maria:] <span class=""quote"">Alas, </span>is that strange news? [...]<br>
[Maria:] <span class=""quote"">Alas my son's distraught. Sweete boy appease<br>
Thy mutining affections.<br></span>
[Antonio:] By the astonning terror of swart night,<br>
By the infectious damps of clammie graues,<br>
And by the mould that presseth downe<br>
My deade fathers sculle: Ile be reueng'd. ";"Marston, John.  ""Antonios Revenge."" The Plays of John Marston in Three Volumes. Ed. H. Harvey Wood. Edinburgh and London: Oliver and Boyd, 1934-1939. 1:65-134.  95.";"Heeg Stefanie"
" I should be greeted, if not from Lord Hamlet.";"unedited";"John Marston";"Antonio's Revenge";"Marston, John.  ""Antonios Revenge."" The Plays of John Marston in Three Volumes. Ed. H. Harvey Wood. Edinburgh and London: Oliver and Boyd, 1934-1939. 1:65-134.  105.";"1600";"1600";"1600";"1600";"English";"[Antonio:] [...] <span class=""quote"">Blood cries for blood</span>, and murder murder craves.";"";"";"@001271_A00_D02 Antonio's Revenge";"";"WoPh#032183 blood will have blood";"Work unmarked";"Author unmarked";"Tragedy";"";"Dialogue";"BODY OF TEXT";"";"Secondary (Annotated edition_Literature)";"@010047-147.";"";"";"Heeg Stefanie"
" I should be greeted, if not from Lord Hamlet.";"unedited";"William Shakespeare";"Hamlet";"Shakespeare, William.  Hamlet.  Act 5, scene 1.";"1600";"1600";"1600";"1600";"English";"[Hamlet:] <span class=""quote"">What is he whose grief
Bears such an emphasis,</span> whose phrase of sorrow
Conjures the wand’ring stars and makes them stand
Like wonder-wounded hearers? <span class=""quote"">This is I,
Hamlet the Dane.</span>";"";"";"@001259_A00_D23 Hamlet";"";"SuMe#032184 competition grief";"Work unmarked";"Author unmarked";"Tragedy";"";"Dialogue";"BODY OF TEXT";"";"Secondary (Annotated edition_Literature)";"@010047-169.";"";"";"Heeg Stefanie"
" I should be greeted, if not from Lord Hamlet.";"unedited";"John Marston";"Antonio's Revenge";"Marston, John.  ""Antonios Revenge."" The Plays of John Marston in Three Volumes. Ed. H. Harvey Wood. Edinburgh and London: Oliver and Boyd, 1934-1939. 1:65-134.  121.";"1600";"1600";"1600";"1600";"English";"[Pandulpho:] [...] Yet I am less than a man. I am the miserables soul that breathes. <br>
[Antonio:] 'Slid, sir, ye lie! by h'heart of grief, thou lies!
I scorn't that any wretched should survive 
Outmounting me in that superlative:
<span class=""quote"">Most miserable, most unmatched woe.
Who dare assume that, but Antonio?</span>";"";"";"@001271_A00_D02 Antonio's Revenge";"";"SuMe#032184 competition grief";"Work unmarked";"Author unmarked";"Tragedy";"";"Dialogue";"BODY OF TEXT";"";"Secondary (Annotated edition_Literature)";"@010047-169.";"";"";"Heeg Stefanie"
" I should be greeted, if not from Lord Hamlet.";"unedited";"William Shakespeare";"Hamlet";"Shakespeare, William.  Hamlet.  Act 2, scene 2, line 496.";"1600";"1600";"1600";"1600";"English";"[First Player:] [...] <span class=""quote"">Repugnant to command. Unequal matched </span>[...].";"";"";"@001259_A00_D23 Hamlet";"";"SuId#032163 repugnant to command, unequal matched";"Work unmarked";"Author unmarked";"Tragedy";"";"Dialogue";"BODY OF TEXT";"Local reference";"Secondary (Academic_Shakespeare)";"@010052
Potts, Abbie Findlay. ""Hamlet and Gloriana’s Knights."" SQ 6.1 (Winter 1955): 31-43. ";"";"";"Heeg Stefanie"
" I should be greeted, if not from Lord Hamlet.";"unedited";"John Marston";"Antonio's Revenge";"Marston, John.  ""Antonios Revenge."" The Plays of John Marston in Three Volumes. Ed. H. Harvey Wood. Edinburgh and London: Oliver and Boyd, 1934-1939. 1:65-134.  123 [normalized spelling].";"1600";"1600";"1600";"1600";"English";"[Andrugio:]<span class=""quote""> The fist of strenuous vengeance is clutched</span> [...].";"";"";"@001271_A00_D02 Antonio's Revenge";"";"WoPh_NewWot#230130 strenuous fist of vengeance";"Work unmarked";"Author unmarked";"Theatre";"";"Dialogue";"BODY OF TEXT";"Local reference";"Secondary (Annotated edition_Literature)";"@010047-171./@010038-14./@010038-144.";"[Andrugio:] <span class=""quote"">The fist of strenuous vengeance is clutcht</span> [...].";"Marston, John.  ""Antonios Revenge."" The Plays of John Marston in Three Volumes. Ed. H. Harvey Wood. Edinburgh and London: Oliver and Boyd, 1934-1939. 1:65-134.  123.";"Heeg Stefanie"
" I should be greeted, if not from Lord Hamlet.";"unedited";"John Marston";"Antonio's Revenge";"Marston, John.  ""Antonios Revenge."" The Plays of John Marston in Three Volumes. Ed. H. Harvey Wood. Edinburgh and London: Oliver and Boyd, 1934-1939. 1:65-134.  123 [normalized spelling].";"1600";"1600";"1600";"1600";"English";"[Andrugio:] [...] now is his fate grown <span class=""quote"">mellow, <br>
Instant to fall into the rotten jaws <br>
Of chap-fall'n death. </span>";"";"";"@001271_A00_D02 Antonio's Revenge";"";"WoPh#230131 now mellow drop to death";"Work unmarked";"Author unmarked";"Tragedy";"";"Dialogue";"BODY OF TEXT";"";"Secondary (Annotated edition_Literature)";"@010047-172.";"[Andrugio:] [...] now is his fate growne mellow, <br>
Instant to fall into the rotten jawes <br>
Of chap-falne death. ";"Marston, John.  ""Antonios Revenge."" The Plays of John Marston in Three Volumes. Ed. H. Harvey Wood. Edinburgh and London: Oliver and Boyd, 1934-1939. 1:65-134.  123. ";"Heeg Stefanie"
" I should be greeted, if not from Lord Hamlet.";"unedited";"William Shakespeare";"Hamlet";"Shakespeare, William.  Hamlet.  Act 3, scene 1, lines 146-151.";"1600";"1600";"1600";"1600";"English";"[Hamlet:] If thou dost marry, I'll give thee this plague for thy dowry: be thou as chaste as ice, as pure as snow, thou shalt not escape calumny. Get thee to a nunnery, farewell. Or if thou wilt needs marry, marry a fool, for <span class=""quote"">wise men know well enough what monsters you make of them. </span>";"";"";"@001259_A00_D23 Hamlet";"";"SuId_GenWom_GenMen#035261 women making monsters of men";"Work unmarked";"Author unmarked";"Tragedy";"";"Dialogue";"BODY OF TEXT";"Local reference";"Secondary (Academic_Shakespeare)";"@010052
Potts, Abbie Findlay. ""Hamlet and Gloriana’s Knights."" SQ 6.1 (Winter 1955): 31-43. ";"";"";"  Hohl Regula"
" I should be greeted, if not from Lord Hamlet.";"unedited";"William Shakespeare";"Hamlet";"Shakespeare, William.  Hamlet.  Act 4, scene 2, line 6.";"1600";"1600";"1600";"1600";"English";" [Hamlet:] <span class=""quote"">Compounded it with dust, whereto 'tis kin.</span>";"";"";"@001259_A00_D23 Hamlet";"";"WoPh#030293 compounded with dust";"Work unmarked";"Author unmarked";"Tragedy";"";"Dialogue";"BODY OF TEXT";"Local reference";"Secondary (Annotated edition_Shakespeare)";"@010082
Shakespeare, William.  Hamlet. The Oxford Shakespeare. Ed. G. R. Hibbard. Oxford and New York: Oxford University Press, 1994.";"";"";"  Hohl Regula"
" I should be greeted, if not from Lord Hamlet.";"unedited";"William Shakespeare";"Hamlet";"Shakespeare, William.  Hamlet.  Act 3, scene 1, lines 121-126.";"1600";"1600";"1600";"1600";"English";"[Hamlet:]<span class=""quote""> Ay, truly, for the power of beauty will sooner
transform honesty from what it is to a bawd than
the force of honesty can translate beauty into his
likeness. This was sometime a paradox, but now
the time gives it proof. I did love you once.";"";"";"@001259_A00_D23 Hamlet";"";"SuId#032166 honesty vs beauty";"Work unmarked";"Author unmarked";"Tragedy";"";"Dialogue";"BODY OF TEXT";"Local reference";"Secondary (Academic_Shakespeare)";"@010045
Muir, Kenneth. The Sources of Shakespeare's Plays. London: Methuen, 1977.";"";"";"Heeg Stefanie"
" I should be greeted, if not from Lord Hamlet.";"unedited";"William Shakespeare";"Hamlet";"Shakespeare, William.  Hamlet.  Act 2, scene 1, lines 88-91.";"1600";"1600";"1600";"1600";"English";"[Ophelia:] Lord Hamlet, with his <span class=""quote"">doublet all unbraced, <br>
No hat upon his head, his stockings fouled, <br>
Ungartered, and down-gyvèd to his ankle,</span> <br>
Pale as his shirt, his knees knocking each other […]";"";"";"@001259_A00_D23 Hamlet";"";"SuMe#030210 careless dress out of madness or distress";"Work unmarked";"Author unmarked";"Tragedy";"";"Dialogue";"BODY OF TEXT";"Local reference";"Secondary (Academic_Shakespeare) / Secondary (Annotated edition_Shakespeare)";"@010082/@010000/@010200-168.
Shakespeare, William. Hamlet. The Oxford Shakespeare. Ed. G. R. Hibbard. Oxford and New York: Oxford University Press, 1994.";"";"";"Heeg Stefanie"
" I should be greeted, if not from Lord Hamlet.";"unedited";"William Shakespeare";"Hamlet";"Shakespeare, William.  Hamlet.  Act 4, scene 2, lines 15-21.";"1600";"1600";"1600";"1600";"English";"[Rosencrantz:] <span class=""quote"">Take you me for a sponge, my lord? <br></span>
[Hamlet:] <span class=""quote"">Ay, sir, that soaks up the king's countenance [...]<br>
when he needs what you have gleaned, it is but squeezing you, and sponge, you shall be dry again.</span>";"";"";"@001259_A00_D23 Hamlet";"";"SuMi#032121 sycophant as a sponge";"Work unmarked";"Author unmarked";"Tragedy";"";"Dialogue";"BODY OF TEXT";"Local reference";"Secondary (Academic_Shakespeare) / Secondary (Annotated edition_Shakespeare)";"@010082/@010072/@010047-64./@010200-166.
Shakespeare, William. Hamlet. The Oxford Shakespeare. Ed. G. R. Hibbard. Oxford and New York: Oxford University Press, 1994.<br>
Theobald, W. M. The Classical Element in the Shakespeare Plays. London: Robert Banks, 1909. ";"";"";"  Hohl Regula"
" I should be greeted, if not from Lord Hamlet.";"unedited";"William Shakespeare";"Hamlet";"Shakespeare, William.  Hamlet.  Act 2, scene 2, lines 94-96 and 105-106.";"1600";"1600";"1600";"1600";"English";"[Polonius:] […] <span class=""quote"">That he's mad, 'tis true; 'tis true 'tis pity, <br>
And pity 'tis 'tis true - a foolish figure </span>[…].";"";"";"@001259_A00_D23 Hamlet";"";"SuMe#030214 mad foolish figure";"Work unmarked";"Author unmarked";"Tragedy";"";"Dialogue";"BODY OF TEXT";"Local reference";"Electronic search (Fulltext database_Literature)";"@010084";"";"";"Heeg Stefanie"
" I should be greeted, if not from Lord Hamlet.";"unedited";"William Shakespeare";"Hamlet";"Shakespeare, William.  Hamlet.  Act 4, scene 3, line 4.";"1600";"1600";"1600";"1600";"English";"[King:] [...]<span class=""quote""> the distracted multitude </span>[...].";"";"";"@001259_A00_D23 Hamlet";"";"WoPh#230120 distracted multitude";"Work unmarked";"Author unmarked";"Theatre";"";"Dialogue";"BODY OF TEXT";"Local reference";"Secondary (Academic_Shakespeare)";"@010031/@010050";"";"";"  Hohl Regula"
" I should be greeted, if not from Lord Hamlet.";"unedited";"William Shakespeare";"Hamlet";"Shakespeare, William.  Hamlet.  Act 1, scene 3, line 7.";"1600";"1600";"1600";"1600";"English";"[King:] <span class=""quote"">To bear all smooth and even [...]. ";"";"";"@001259_A00_D23 Hamlet";"";"WoPh#030245 bear smooth and even";"Work unmarked";"Author unmarked";"Tragedy";"";"Dialogue";"BODY OF TEXT";"Local reference";"Secondary (Annotated edition_Shakespeare)";"@010082
Shakespeare, William. Hamlet. The Oxford Shakespeare. Ed. G. R. Hibbard. Oxford and New York: Oxford University Press, 1994. ";"";"";"  Hohl Regula"
" I should be greeted, if not from Lord Hamlet.";"unedited";"William Shakespeare";"Hamlet";"Shakespeare, William.  Hamlet.  Act 2, scene 2, lines 118-119.";"1600";"1600";"1600";"1600";"English";"[Polonius:] [...] <span class=""quote"">the most beautified Ophelia -<br>
That's an ill phrase, a vile phrase; ""beautified"" </span>[...].";"";"";"@001259_A00_D23 Hamlet";"";"WoMo#030217 beautified / SuId#030218 good or vile word or phrase";"Work unmarked";"Author unmarked";"Tragedy";"";"Dialogue";"BODY OF TEXT";"MQ_VERBAL_Noun / MQ_ANOMALY_Nominalization";"Secondary (Academic_Shakespeare)";"@010064/@010052/@010082/@010076/@010136";"";"";"Heeg Stefanie"
" For in that sleep of death what dreams may come";"ok";"John Bodenham";"Belvedere";"Bodenham, John and Anthony Munday.  Bel-vedere or The Garden of The Muses. London: F.K. for Hugh Astley 1600.  232.";"1600";"1600";"1600";"1600";"English";"Of Death<br>
[...]<br>
Similies on the same subject<br>
So <span class=""quote"">sleep of death </span>ends all our wretchedness.";"";"";"@005041 Belvedere";"";"SuId_AbsDea#030069 death as sleep / WoTo#006941 sleep of death";"Work unmarked";"Author unmarked";"Anthology";"";"";"ANTHOLOGY ENTRY";"MQ_GENRE / MQ_TYPOGRAPHY_Heading";"Secondary (Academic_Literature)";"@010079/@006323-Last accessed 10 March 2020.
Stallybrass, Peter. ""Against Thinking."" PMLA 122.5 (2007): 1580-1587.";"";"";"  Hohl Regula"
" I should be greeted, if not from Lord Hamlet.";"unedited";"William Shakespeare";"Hamlet";"Shakespeare, William.  Hamlet.  Act 4, scene 3, line 75.";"1600";"1600";"1600";"1600";"English";"[King:]<span class=""quote""> For like the hectic in my blood rages </span>[...].";"";"";"@001259_A00_D23 Hamlet";"";"WoPh#030670 rage in blood";"Work unmarked";"Author unmarked";"Tragedy";"";"Dialogue";"BODY OF TEXT";"Local reference";"Electronic search (Fulltext database_Literature)";"@010054";"";"";"  Hohl Regula"
" I should be greeted, if not from Lord Hamlet.";"unedited";"William Shakespeare";"Hamlet";"Shakespeare, William.  Hamlet.  Act 5, scene 1, line 254.";"1600";"1600";"1600";"1600";"English";"[Queen:] <span class=""quote"">Sweets to the sweet, farewell!</span>";"";"";"@001259_A00_D23 Hamlet";"";"WoPh#230118 ashes to ashes";"Work unmarked";"Author unmarked";"Tragedy";"";"Dialogue";"BODY OF TEXT";"Local reference";"Secondary (Academic_Shakespeare)";"@010151";"";"";"Heeg Stefanie"
" I should be greeted, if not from Lord Hamlet.";"unedited";"William Shakespeare";"Hamlet";"Shakespeare, William.  Hamlet.  Act 3, scene 1, line 106.";"1600";"1600";"1600";"1600";"English";"[Ophelia:] <span class=""quote"">Rich gifts wax poor when givers prove unkind.</span>";"";"";"@001259_A00_D23 Hamlet";"";"SuMe#032173 value gifts and kindness";"Work unmarked";"Author unmarked";"Tragedy";"";"Dialogue";"BODY OF TEXT";"Local reference";"Secondary (Academic_Shakespeare)";"@010151/@010050";"";"";"Heeg Stefanie"
" I should be greeted, if not from Lord Hamlet.";"unedited";"William Shakespeare";"Hamlet";"Shakespeare, William.  Hamlet.  Act 4, scene 5, lines 28-29.";"1600";"1600";"1600";"1600";"English";"[Ophelia:] <span class=""quote"">How should I your true love know <br> 
From another one? </span>";"";"";"@001259_A00_D23 Hamlet";"";"WoPh#030671 true love know how";"Work unmarked";"Author unmarked";"Tragedy";"";"Dialogue";"BODY OF TEXT";"Local reference";"Secondary (Academic_Shakespeare) / Secondary (Annotated edition_Shakespeare)";"@010082-186./@010069-108.
Sternfeld, F. W. ""Ophelia's Version of the Walsingham Song."" Music and Letters 45:2 (April 1964): 108-113.  108.<br>
Shakespeare, William. Hamlet. The Oxford Shakespeare. Ed. G. R. Hibbard. Oxford and New York: Oxford University Press, 1994. <br>
Anders, H. R. D. Shakespeare's Books. Berlin: Georg Reimer, 1904. 186.
";"";"";"  Hohl Regula"
" For who would bear the whips and scorns of time,";"provisional";"John Marston";"Antonio's Revenge";"Marston, John.  ""Antonios Revenge."" The Plays of John Marston in Three Volumes. Ed. H. Harvey Wood. Edinburgh and London: Oliver and Boyd, 1934-1939. 1:65-134.  116 [normalized spelling].";"1600";"1600";"1600";"1600";"English";"[Alberto:] [...] There is a thing called <span class=""quote"">scourging Nemesis.</span>";"";"";"@001271_A00_D02 Antonio's Revenge";"";"NaMa#030083 scourging Nemesis / NaCa#004015 Nemesis";"Work unmarked";"Author unmarked";"Tragedy";"";"Dialogue";"BODY OF TEXT";"Local reference";"Secondary (Annotated edition_Literature) / Secondary (Academic_Shakespeare)";"@010158-65./@005134-1:234./@010200-166./@005263-23./@006323-Last accessed 10 March 2020.
Wood, Harvey,  ed. The Plays of John Marston in Three Volumes. Ed. H. Harvey Wood. Edinburgh and London: Oliver and Boyd, 1934-1939.
";"[Alberto:] [...] There is a thing cald <span class=""quote"">scourging Nemesis.</span>";"Marston, John.  ""Antonios Revenge."" The Plays of John Marston in Three Volumes. Ed. H. Harvey Wood. Edinburgh and London: Oliver and Boyd, 1934-1939. 1:65-134.  116.";"  Hohl Regula"
" I should be greeted, if not from Lord Hamlet.";"unedited";"William Shakespeare";"Hamlet";"Shakespeare, William.  Hamlet.  Act 4, Scene 5, lines 34-35.";"1600";"1600";"1600";"1600";"English";"[Ophelia:] [...] <span class=""quote"">He is dead and gone, lady, <br>
He is dead and gone.</span>";"";"";"@001259_A00_D23 Hamlet";"";"WoPh#030076 he is dead, he is gone";"Work unmarked";"Author unmarked";"Theatre";"";"Dialogue";"BODY OF TEXT";"Local reference";"Electronic search (Fulltext database_Literature)";"@010001";"";"";"  Hohl Regula"
" Hyperion's curls; the front of Jove himself;";"ok";"John Marston";"Antonio's Revenge";"Marston, John.  ""Antonios Revenge."" The Plays of John Marston in Three Volumes. Ed. H. Harvey Wood. Edinburgh and London: Oliver and Boyd, 1934-1939. 1:65-134.  103 [normalized spelling].";"1600";"1600";"1600";"1600";"English";"[Antonio:] [...] Me thinks I pass upon <span class=""quote"">the front of Jove,</span><br>
And kick corruption with a scornful heel,<br>
Griping this flesh, disdain mortality. ";"";"";"@001271_A00_D02 Antonio's Revenge";"";"NaMa#080024 front of Jove / NaCa#032237 Jove or Jupiter or Zeus";"Work unmarked";"Author unmarked";"Tragedy";"";"Dialogue";"BODY OF TEXT";"Local reference";"Secondary (Academic_Shakespeare)";"@010005
Greenfield, Sayre. ""Quoting Hamlet in the Early Seventeenth Century."" Modern Philology 105.3 (2008): 510-534.";"[Antonio:] [...] Me thinks I pase vpon <span class=""quote"">the front of Ioue,</span><br>
And kick corruption with a scornefull heele,<br>
Griping this flesh, disdaine mortalitie. ";"Marston, John.  ""Antonios Revenge."" The Plays of John Marston in Three Volumes. Ed. H. Harvey Wood. Edinburgh and London: Oliver and Boyd, 1934-1939. 1:65-134.  103.";"  Hohl Regula"
" I should be greeted, if not from Lord Hamlet.";"unedited";"William Shakespeare";"Hamlet";"Shakespeare, William.  Hamlet.  Act 2, scene 2, lines 583-584.";"1600";"1600";"1600";"1600";"English";"[Hamlet:] [...] <span class=""quote"">A broken voice, and his whole function suiting<br>
With forms to his conceit? and all for nothing! </span>";"";"";"@001259_A00_D23 Hamlet";"";"WoKw#032176 conceit + function";"Work unmarked";"Author unmarked";"Tragedy";"";"Dialogue";"BODY OF TEXT";"Local reference";"Secondary (Academic_Shakespeare)";"@010000-1:418./@010200-169.
Munro, John, Clement Mansfield Ingleby et al., eds. The Shakspere Allusion Book: A Collection of Allusions to Shakspere from 1591 to 1700 [...]. London: Chatto and Windus; New York: Duffield and Co., 1909. 1:418.";"";"";"  Hohl Regula"
" I should be greeted, if not from Lord Hamlet.";"unedited";"William Shakespeare";"Hamlet";"Shakespeare, William.  Hamlet.  Act 3, scene 4, lines 103-106.";"1600";"1600";"1600";"1600";"English";"[Hamlet:] Nay, but to live <br>
<span class=""quote"">In the rank sweat of an enseamèd bed,<br> 
Stewed in corruption, honeying and making love <br>
Over the nasty sty!</span>";"";"";"@001259_A00_D23 Hamlet";"";"WoKw#032177 stewed in lust or bed";"Work unmarked";"Author unmarked";"Tragedy";"";"Dialogue";"BODY OF TEXT";"Local reference";"Secondary (Academic_Shakespeare)";"@010000-1:418./@010082";"";"";"  Hohl Regula"
" I should be greeted, if not from Lord Hamlet.";"unedited";"William Shakespeare";"Hamlet";"Shakespeare, William.  Hamlet.  Act 2, scene 2, line 333.";"1600";"1600";"1600";"1600";"English";"[Hamlet:] <span class=""quote"">Man delights not no, nor woman neither, though by your smiling</span> [...].";"";"";"@001259_A00_D23 Hamlet";"";"WoPh#032178 nor no man";"Work unmarked";"Author unmarked";"Tragedy";"";"Dialogue";"BODY OF TEXT";"Local reference";"Secondary (Annotated edition_Shakespeare)";"@010082";"";"";"Heeg Stefanie"
" I should be greeted, if not from Lord Hamlet.";"unedited";"William Shakespeare";"Hamlet";"Shakespeare, William.  Hamlet.  Act 4, scene 5, lines 205-206.";"1600";"1600";"1600";"1600";"English";"[Ophelia:] [...] <span class=""quote"">there's rue for you; and here's some for me: we may call it herb-grace o' Sundays </span>[...].";"";"";"@001259_A00_D23 Hamlet";"";"WoMo#030278 rue";"Work unmarked";"Author unmarked";"Tragedy";"";"Dialogue";"BODY OF TEXT";"Local reference";"Secondary (Annotated edition_Shakespeare)";"@010082
Shakespeare, William. Hamlet. The Oxford Shakespeare. Ed. G. R. Hibbard. Oxford and New York: Oxford University Press, 1994. ";"";"";"  Hohl Regula"
" I should be greeted, if not from Lord Hamlet.";"unedited";"William Shakespeare";"Hamlet";"Shakespeare, William.  Hamlet.  Act 1, scene 1, lines 42-45.";"1600";"1600";"1600";"1600";"English";"[Barnado:] Last night of all, <br>
When <span class=""quote"">yond same star that's westward from the pole<br>
Had made his course t' illume that part of heaven</span><br>
Where now it burns, Marcellus and myself, <br>
<span class=""quote"">The bell then beating one</span> -";"";"";"@001259_A00_D23 Hamlet";"";"WoPh_NatSky#032206 yond star / WoPh_NatSky#004132 illume that part of heaven / WoPh#032293 the bell then beating one";"Work unmarked";"Author unmarked";"Tragedy";"";"Dialogue";"BODY OF TEXT";"Local reference";"Secondary (Annotated edition_Literature)";"@005700-56.";"";"";"Heeg Stefanie"
" I should be greeted, if not from Lord Hamlet.";"unedited";"William Shakespeare";"Hamlet";"Shakespeare, William.  Hamlet.  Act 1, scene 5, line 209.";"1600";"1600";"1600";"1600";"English";"[Hamlet:] [...]  <span class=""quote"">And still your fingers on your lips, I pray. </span>";"";"";"@001259_A00_D23 Hamlet";"";"WoPh#004409 finger on your lips (sst!)";"Work unmarked";"Author unmarked";"Tragedy";"";"Dialogue";"BODY OF TEXT";"Local reference";"Secondary (Academic_Literature)";"@010076/@010082/@010050
Tilley, Morris Palmer. A Dictionary of the Proverbs in England in the Sixteenth and Seventeenth Centuries […]. Ann Arbor 1950.";"";"";"  Hohl Regula"
" I should be greeted, if not from Lord Hamlet.";"unedited";"William Shakespeare";"Hamlet";"Shakespeare, William.  Hamlet.  Act 2, scene 2, lines 318-320.";"1600";"1600";"1600";"1600";"English";"[Hamlet:] [...] I have of late, but wherefore I know not, lost all my mirth,<span class=""quote""> forgone all custom of exercises </span>[...].";"";"";"@001259_A00_D23 Hamlet";"";"WoPh#030762 custom of exercises";"Work unmarked";"Author unmarked";"Tragedy";"";"Dialogue";"BODY OF TEXT";"Local reference";"Secondary (Academic_Shakespeare)";"@010045/@010030/@010200

Muir, Kenneth. The Sources of Shakespeare's Plays. London: Methuen, 1977.<br>
Shaheen, Naseeb. Biblical References in Shakespeare's Tragedies. Newark: University of Delaware Press, 1999. ";"";"";"  Hohl Regula"
" I should be greeted, if not from Lord Hamlet.";"unedited";"William Shakespeare";"Hamlet";"Shakespeare, William.  Hamlet.  Act 1, scene 4, lines 57-59 and 86-88.";"1600";"1600";"1600";"1600";"English";"[Hamlet:] Making night hideous; and <span class=""quote"">we fools of nature </span><br>
So horridly to shake our disposition<br>
With thoughts beyond the reaches of our souls?<br>
[...]<br>
<span class=""quote"">But that the dread of something after death</span>,<br>
The <span class=""quote"">undiscover'd country</span> from whose bourn<br>
No traveller returns, puzzles the will.";"";"";"@001259_A00_D23 Hamlet";"";"SuId_AbsDea#030086 something after death / SuId_NatLan_AbsDea#030087 undiscovered country / WoTo#030094 fools of nature / SuId#004138 unknown things are scary";"Work unmarked";"Author unmarked";"Tragedy";"";"Dialogue";"BODY OF TEXT";"Local reference";"Secondary (Academic_Shakespeare)";"@010006/@010005/@010050/@010082/@005134/@010101/@005249/@010043/@010200-169.
Williams, John Davis Ellis. Sir William Davenant's relation to Shakespeare: With an analysis of the Chief Characters of Davenant's Plays. PhD Strassburg 1905. 13.";"";"";"Heeg Stefanie"
